index,query,answer,subgraph_nodes,query_fig_name,answer_fig_name,main_relation,query_type,query_text,query_html,explanation_text,explanation_html,baseline_with_explanation,baseline_without_explanation
1,"(p,(Synchronous),(e,(the second world war commence)))",nazi germany invade poland,"['the second world war commence', 'nazi germany invade poland']",20220408-210125-batch-0-q-1.png,20220408-210125-batch-0-a-1.png,Synchronous,1p,the second world war commence happens the same time as the eventuality V?. What is the eventuality V? ?,"<span style=""color:red;"">the second world war commence</span> happens the same time as <span style=""color:red;"">the eventuality V?</span>. What is the eventuality V? ?",the second world war commence happens the same time as nazi germany invade poland.,"<span style=""color:red;"">the second world war commence</span> happens the same time as <span style=""color:red;"">nazi germany invade poland</span>.",yes,yes
2,"(p,(Reason),(e,(PersonX would have to give way to PersonY)))",PersonY be the elder,"['PersonX would have to give way to PersonY', 'PersonY be the elder']",20220408-210125-batch-0-q-2.png,20220408-210125-batch-0-a-2.png,Reason,1p,PersonX would have to give way to PersonY happens because the eventuality V?. What is the eventuality V? ?,"<span style=""color:red;"">PersonX would have to give way to PersonY</span> happens because <span style=""color:red;"">the eventuality V?</span>. What is the eventuality V? ?",PersonX would have to give way to PersonY happens because PersonY be the elder.,"<span style=""color:red;"">PersonX would have to give way to PersonY</span> happens because <span style=""color:red;"">PersonY be the elder</span>.",yes,no
3,"(p,(Condition),(e,(PersonY would care about PersonX)))",PersonX be in love with PersonZ,"['PersonY would care about PersonX', 'PersonX be in love with PersonZ']",20220408-210125-batch-0-q-3.png,20220408-210125-batch-0-a-3.png,Condition,1p,"When the eventuality V? happens, PersonY would care about PersonX can happen. What is the eventuality V? ?","When <span style=""color:red;"">the eventuality V?</span> happens, <span style=""color:red;"">PersonY would care about PersonX</span> can happen. What is the eventuality V? ?","When PersonX be in love with PersonZ happens, PersonY would care about PersonX can happen.","When <span style=""color:red;"">PersonX be in love with PersonZ</span> happens, <span style=""color:red;"">PersonY would care about PersonX</span> can happen.",yes,yes
4,"(p,(Result),(e,(the video take a while to load)))",it be just a picture,"['the video take a while to load', 'it be just a picture']",20220408-210125-batch-0-q-4.png,20220408-210125-batch-0-a-4.png,Result,1p,the video take a while to load result in the eventuality V?. What is the eventuality V? ?,"<span style=""color:red;"">the video take a while to load</span> result in <span style=""color:red;"">the eventuality V?</span>. What is the eventuality V? ?",the video take a while to load result in it be just a picture.,"<span style=""color:red;"">the video take a while to load</span> result in <span style=""color:red;"">it be just a picture</span>.",no,no
5,"(p,(Alternative),(e,(PersonX might return to PersonY)))",PersonX might leave PersonY,"['PersonX might return to PersonY', 'PersonX might leave PersonY']",20220408-210125-batch-0-q-5.png,20220408-210125-batch-0-a-5.png,Alternative,1p,PersonX might return to PersonY is an alternative situation to the eventuality V?. What is the eventuality V? ?,"<span style=""color:red;"">PersonX might return to PersonY</span> is an alternative situation to <span style=""color:red;"">the eventuality V?</span>. What is the eventuality V? ?",PersonX might return to PersonY is an alternative situation to PersonX might leave PersonY.,"<span style=""color:red;"">PersonX might return to PersonY</span> is an alternative situation to <span style=""color:red;"">PersonX might leave PersonY</span>.",no,no
6,"(p,(Instantiation),(e,(it have a map)))",PersonX can select,"['it have a map', 'PersonX can select']",20220408-210125-batch-0-q-6.png,20220408-210125-batch-0-a-6.png,Instantiation,1p,the eventuality V? is a more detailed description of it have a map. What is the eventuality V? ?,"<span style=""color:red;"">the eventuality V?</span> is a more detailed description of <span style=""color:red;"">it have a map</span>. What is the eventuality V? ?",PersonX can select is a more detailed description of it have a map. it have a map and PersonX can select both happen.,"<span style=""color:red;"">PersonX can select</span> is a more detailed description of <span style=""color:red;"">it have a map</span>. <span style=""color:red;"">it have a map</span> and <span style=""color:red;"">PersonX can select</span> both happen.",yes,no
7,"(p,(Instantiation),(e,(it have a map)))",PersonY can select,"['it have a map', 'PersonY can select']",20220408-210125-batch-0-q-7.png,20220408-210125-batch-0-a-7.png,Instantiation,1p,the eventuality V? is a more detailed description of it have a map. What is the eventuality V? ?,"<span style=""color:red;"">the eventuality V?</span> is a more detailed description of <span style=""color:red;"">it have a map</span>. What is the eventuality V? ?",PersonY can select is a more detailed description of it have a map. it have a map and PersonY can select both happen.,"<span style=""color:red;"">PersonY can select</span> is a more detailed description of <span style=""color:red;"">it have a map</span>. <span style=""color:red;"">it have a map</span> and <span style=""color:red;"">PersonY can select</span> both happen.",yes,no
8,"(p,(Synchronous),(e,(some people be in for a surprise)))",the tournament start,"['some people be in for a surprise', 'the tournament start']",20220408-210125-batch-0-q-8.png,20220408-210125-batch-0-a-8.png,Synchronous,1p,some people be in for a surprise happens the same time as the eventuality V?. What is the eventuality V? ?,"<span style=""color:red;"">some people be in for a surprise</span> happens the same time as <span style=""color:red;"">the eventuality V?</span>. What is the eventuality V? ?",some people be in for a surprise happens the same time as the tournament start.,"<span style=""color:red;"">some people be in for a surprise</span> happens the same time as <span style=""color:red;"">the tournament start</span>.",yes,yes
9,"(p,(ChosenAlternative),(e,(president roosevelt refuse to accept PersonX resignation)))",it would not reopen,"['president roosevelt refuse to accept PersonX resignation', 'it would not reopen']",20220408-210125-batch-0-q-9.png,20220408-210125-batch-0-a-9.png,ChosenAlternative,1p,president roosevelt refuse to accept PersonX resignation is a preferred alternative situation to the eventuality V?. What is the eventuality V? ?,"<span style=""color:red;"">president roosevelt refuse to accept PersonX resignation</span> is a preferred alternative situation to <span style=""color:red;"">the eventuality V?</span>. What is the eventuality V? ?",president roosevelt refuse to accept PersonX resignation is a preferred alternative situation to it would not reopen.,"<span style=""color:red;"">president roosevelt refuse to accept PersonX resignation</span> is a preferred alternative situation to <span style=""color:red;"">it would not reopen</span>.",no,no
10,"(p,(Restatement),(e,(PersonX look up at PersonY sharply)))",PersonX do not quite believe PersonY,"['PersonX look up at PersonY sharply', 'PersonX do not quite believe PersonY']",20220408-210125-batch-0-q-10.png,20220408-210125-batch-0-a-10.png,Restatement,1p,the eventuality V? restates PersonX look up at PersonY sharply. What is the eventuality V? ?,"<span style=""color:red;"">the eventuality V?</span> restates <span style=""color:red;"">PersonX look up at PersonY sharply</span>. What is the eventuality V? ?",PersonX do not quite believe PersonY restates PersonX look up at PersonY sharply.,"<span style=""color:red;"">PersonX do not quite believe PersonY</span> restates <span style=""color:red;"">PersonX look up at PersonY sharply</span>.",no,no
11,"(p,(Restatement),(e,(a moment of silence ensue)))",something extraordinary have happen,"['a moment of silence ensue', 'something extraordinary have happen']",20220408-210125-batch-0-q-11.png,20220408-210125-batch-0-a-11.png,Restatement,1p,the eventuality V? restates a moment of silence ensue. What is the eventuality V? ?,"<span style=""color:red;"">the eventuality V?</span> restates <span style=""color:red;"">a moment of silence ensue</span>. What is the eventuality V? ?",something extraordinary have happen restates a moment of silence ensue.,"<span style=""color:red;"">something extraordinary have happen</span> restates <span style=""color:red;"">a moment of silence ensue</span>.",no,no
12,"(p,(Reason),(p,(Reason),(e,(PersonX do not have to patronize PersonY))))",PersonX can not walk away,"['PersonX do not have to patronize PersonY', 'PersonX do not have a choice', 'PersonX can not walk away']",20220408-210125-batch-0-q-12.png,20220408-210125-batch-0-a-12.png,Reason,2p,PersonX do not have to patronize PersonY happens because the eventuality V0. the eventuality V0 happens because the eventuality V?. What is the eventuality V? ?,"<span style=""color:red;"">PersonX do not have to patronize PersonY</span> happens because <span style=""color:red;"">the eventuality V0</span>. <span style=""color:red;"">the eventuality V0</span> happens because <span style=""color:red;"">the eventuality V?</span>. What is the eventuality V? ?",PersonX do not have to patronize PersonY happens because PersonX do not have a choice. PersonX do not have a choice happens because PersonX can not walk away.,"<span style=""color:red;"">PersonX do not have to patronize PersonY</span> happens because <span style=""color:red;"">PersonX do not have a choice</span>. <span style=""color:red;"">PersonX do not have a choice</span> happens because <span style=""color:red;"">PersonX can not walk away</span>.",no,no
13,"(p,(Reason),(p,(Reason),(e,(PersonX do not have to patronize PersonY))))",PersonX do not have enough time,"['PersonX do not have to patronize PersonY', 'PersonX do not have a choice', 'PersonX do not have enough time']",20220408-210125-batch-0-q-13.png,20220408-210125-batch-0-a-13.png,Reason,2p,PersonX do not have to patronize PersonY happens because the eventuality V0. the eventuality V0 happens because the eventuality V?. What is the eventuality V? ?,"<span style=""color:red;"">PersonX do not have to patronize PersonY</span> happens because <span style=""color:red;"">the eventuality V0</span>. <span style=""color:red;"">the eventuality V0</span> happens because <span style=""color:red;"">the eventuality V?</span>. What is the eventuality V? ?",PersonX do not have to patronize PersonY happens because PersonX do not have a choice. PersonX do not have a choice and PersonX do not have enough time both happen. PersonX do not have a choice happens because PersonX do not have enough time.,"<span style=""color:red;"">PersonX do not have to patronize PersonY</span> happens because <span style=""color:red;"">PersonX do not have a choice</span>. <span style=""color:red;"">PersonX do not have a choice</span> and <span style=""color:red;"">PersonX do not have enough time</span> both happen. <span style=""color:red;"">PersonX do not have a choice</span> happens because <span style=""color:red;"">PersonX do not have enough time</span>.",no,no
14,"(p,(Reason),(p,(Reason),(e,(PersonX do not have to patronize PersonY))))",it be the right choice,"['PersonX do not have to patronize PersonY', 'PersonX do not have a choice', 'it be the right choice']",20220408-210125-batch-0-q-14.png,20220408-210125-batch-0-a-14.png,Reason,2p,PersonX do not have to patronize PersonY happens because the eventuality V0. the eventuality V0 happens because the eventuality V?. What is the eventuality V? ?,"<span style=""color:red;"">PersonX do not have to patronize PersonY</span> happens because <span style=""color:red;"">the eventuality V0</span>. <span style=""color:red;"">the eventuality V0</span> happens because <span style=""color:red;"">the eventuality V?</span>. What is the eventuality V? ?",PersonX do not have to patronize PersonY happens because PersonX do not have a choice. PersonX do not have a choice and it be the right choice both happen. PersonX do not have a choice happens because it be the right choice.,"<span style=""color:red;"">PersonX do not have to patronize PersonY</span> happens because <span style=""color:red;"">PersonX do not have a choice</span>. <span style=""color:red;"">PersonX do not have a choice</span> and <span style=""color:red;"">it be the right choice</span> both happen. <span style=""color:red;"">PersonX do not have a choice</span> happens because <span style=""color:red;"">it be the right choice</span>.",no,no
15,"(p,(Contrast),(p,(Contrast),(e,(PersonY would like to help PersonX))))",PersonY could not reach PersonX,"['PersonY would like to help PersonX', 'PersonY try to talk to PersonX', 'PersonY could not reach PersonX']",20220408-210125-batch-0-q-15.png,20220408-210125-batch-0-a-15.png,Contrast,2p,PersonY would like to help PersonX and the eventuality V0 share significant difference regarding some property. the eventuality V0 and the eventuality V? share significant difference regarding some property. What is the eventuality V? ?,"<span style=""color:red;"">PersonY would like to help PersonX</span> and <span style=""color:red;"">the eventuality V0</span> share significant difference regarding some property. <span style=""color:red;"">the eventuality V0</span> and <span style=""color:red;"">the eventuality V?</span> share significant difference regarding some property. What is the eventuality V? ?",PersonY would like to help PersonX and PersonY try to talk to PersonX share significant difference regarding some property. PersonY would like to help PersonX happens the same time as PersonY try to talk to PersonX. PersonY try to talk to PersonX and PersonY could not reach PersonX share significant difference regarding some property.,"<span style=""color:red;"">PersonY would like to help PersonX</span> and <span style=""color:red;"">PersonY try to talk to PersonX</span> share significant difference regarding some property. <span style=""color:red;"">PersonY would like to help PersonX</span> happens the same time as <span style=""color:red;"">PersonY try to talk to PersonX</span>. <span style=""color:red;"">PersonY try to talk to PersonX</span> and <span style=""color:red;"">PersonY could not reach PersonX</span> share significant difference regarding some property.",no,no
16,"(p,(Contrast),(p,(Contrast),(e,(PersonY would like to help PersonX))))",PersonX would not listen to PersonY,"['PersonY would like to help PersonX', 'PersonY try to talk to PersonX', 'PersonX would not listen to PersonY']",20220408-210125-batch-0-q-16.png,20220408-210125-batch-0-a-16.png,Contrast,2p,PersonY would like to help PersonX and the eventuality V0 share significant difference regarding some property. the eventuality V0 and the eventuality V? share significant difference regarding some property. What is the eventuality V? ?,"<span style=""color:red;"">PersonY would like to help PersonX</span> and <span style=""color:red;"">the eventuality V0</span> share significant difference regarding some property. <span style=""color:red;"">the eventuality V0</span> and <span style=""color:red;"">the eventuality V?</span> share significant difference regarding some property. What is the eventuality V? ?",PersonY would like to help PersonX and PersonY try to talk to PersonX share significant difference regarding some property. PersonY would like to help PersonX happens the same time as PersonY try to talk to PersonX. PersonY try to talk to PersonX and PersonX would not listen to PersonY share significant difference regarding some property.,"<span style=""color:red;"">PersonY would like to help PersonX</span> and <span style=""color:red;"">PersonY try to talk to PersonX</span> share significant difference regarding some property. <span style=""color:red;"">PersonY would like to help PersonX</span> happens the same time as <span style=""color:red;"">PersonY try to talk to PersonX</span>. <span style=""color:red;"">PersonY try to talk to PersonX</span> and <span style=""color:red;"">PersonX would not listen to PersonY</span> share significant difference regarding some property.",no,no
17,"(p,(Contrast),(p,(Contrast),(e,(PersonY would like to help PersonX))))",PersonX need to hear it from PersonZ,"['PersonY would like to help PersonX', 'PersonY try to talk to PersonX', 'PersonX need to hear it from PersonZ']",20220408-210125-batch-0-q-17.png,20220408-210125-batch-0-a-17.png,Contrast,2p,PersonY would like to help PersonX and the eventuality V0 share significant difference regarding some property. the eventuality V0 and the eventuality V? share significant difference regarding some property. What is the eventuality V? ?,"<span style=""color:red;"">PersonY would like to help PersonX</span> and <span style=""color:red;"">the eventuality V0</span> share significant difference regarding some property. <span style=""color:red;"">the eventuality V0</span> and <span style=""color:red;"">the eventuality V?</span> share significant difference regarding some property. What is the eventuality V? ?",PersonY would like to help PersonX and PersonY try to talk to PersonX share significant difference regarding some property. PersonY would like to help PersonX happens the same time as PersonY try to talk to PersonX. PersonY try to talk to PersonX and PersonX need to hear it from PersonZ share significant difference regarding some property.,"<span style=""color:red;"">PersonY would like to help PersonX</span> and <span style=""color:red;"">PersonY try to talk to PersonX</span> share significant difference regarding some property. <span style=""color:red;"">PersonY would like to help PersonX</span> happens the same time as <span style=""color:red;"">PersonY try to talk to PersonX</span>. <span style=""color:red;"">PersonY try to talk to PersonX</span> and <span style=""color:red;"">PersonX need to hear it from PersonZ</span> share significant difference regarding some property.",no,no
18,"(p,(Reason),(p,(Reason),(e,(PersonY might be lie to PersonX))))",PeopleX do not give a shit about evidence,"['PersonY might be lie to PersonX', 'PersonY can get away with it', 'PeopleX do not give a shit about evidence']",20220408-210125-batch-0-q-18.png,20220408-210125-batch-0-a-18.png,Reason,2p,PersonY might be lie to PersonX happens because the eventuality V0. the eventuality V0 happens because the eventuality V?. What is the eventuality V? ?,"<span style=""color:red;"">PersonY might be lie to PersonX</span> happens because <span style=""color:red;"">the eventuality V0</span>. <span style=""color:red;"">the eventuality V0</span> happens because <span style=""color:red;"">the eventuality V?</span>. What is the eventuality V? ?",PersonY can get away with it happens because PeopleX do not give a shit about evidence. PersonY might be lie to PersonX happens because PersonY can get away with it.,"<span style=""color:red;"">PersonY can get away with it</span> happens because <span style=""color:red;"">PeopleX do not give a shit about evidence</span>. <span style=""color:red;"">PersonY might be lie to PersonX</span> happens because <span style=""color:red;"">PersonY can get away with it</span>.",no,no
19,"(p,(Reason),(p,(Reason),(e,(PersonY might be lie to PersonX))))",it would be wrong,"['PersonY might be lie to PersonX', 'PersonY can get away with it', 'it would be wrong']",20220408-210125-batch-0-q-19.png,20220408-210125-batch-0-a-19.png,Reason,2p,PersonY might be lie to PersonX happens because the eventuality V0. the eventuality V0 happens because the eventuality V?. What is the eventuality V? ?,"<span style=""color:red;"">PersonY might be lie to PersonX</span> happens because <span style=""color:red;"">the eventuality V0</span>. <span style=""color:red;"">the eventuality V0</span> happens because <span style=""color:red;"">the eventuality V?</span>. What is the eventuality V? ?",PersonY can get away with it happens because it would be wrong. PersonY might be lie to PersonX happens because PersonY can get away with it.,"<span style=""color:red;"">PersonY can get away with it</span> happens because <span style=""color:red;"">it would be wrong</span>. <span style=""color:red;"">PersonY might be lie to PersonX</span> happens because <span style=""color:red;"">PersonY can get away with it</span>.",no,no
20,"(p,(Reason),(p,(Reason),(e,(PersonY might be lie to PersonX))))",people can not see,"['PersonY might be lie to PersonX', 'PersonY can get away with it', 'people can not see']",20220408-210125-batch-0-q-20.png,20220408-210125-batch-0-a-20.png,Reason,2p,PersonY might be lie to PersonX happens because the eventuality V0. the eventuality V0 happens because the eventuality V?. What is the eventuality V? ?,"<span style=""color:red;"">PersonY might be lie to PersonX</span> happens because <span style=""color:red;"">the eventuality V0</span>. <span style=""color:red;"">the eventuality V0</span> happens because <span style=""color:red;"">the eventuality V?</span>. What is the eventuality V? ?",PersonY can get away with it happens because people can not see. PersonY might be lie to PersonX happens because PersonY can get away with it.,"<span style=""color:red;"">PersonY can get away with it</span> happens because <span style=""color:red;"">people can not see</span>. <span style=""color:red;"">PersonY might be lie to PersonX</span> happens because <span style=""color:red;"">PersonY can get away with it</span>.",no,no
21,"(p,(Condition),(p,(Concession),(e,(PersonY actually enjoy the experience))))",PersonY have the choice,"['PersonY actually enjoy the experience', 'PersonY probably would not have', 'PersonY have the choice']",20220408-210125-batch-0-q-21.png,20220408-210125-batch-0-a-21.png,Concession,2p,"the eventuality V0 happens although PersonY actually enjoy the experience. When the eventuality V? happens, the eventuality V0 can happen. What is the eventuality V? ?","<span style=""color:red;"">the eventuality V0</span> happens although <span style=""color:red;"">PersonY actually enjoy the experience</span>. When <span style=""color:red;"">the eventuality V?</span> happens, <span style=""color:red;"">the eventuality V0</span> can happen. What is the eventuality V? ?","When PersonY have the choice happens, PersonY probably would not have can happen. PersonY probably would not have happens although PersonY actually enjoy the experience.","When <span style=""color:red;"">PersonY have the choice</span> happens, <span style=""color:red;"">PersonY probably would not have</span> can happen. <span style=""color:red;"">PersonY probably would not have</span> happens although <span style=""color:red;"">PersonY actually enjoy the experience</span>.",no,no
22,"(p,(Condition),(p,(Concession),(e,(PersonY actually enjoy the experience))))",PersonY would say something,"['PersonY actually enjoy the experience', 'PersonY probably would not have', 'PersonY would say something']",20220408-210125-batch-0-q-22.png,20220408-210125-batch-0-a-22.png,Concession,2p,"the eventuality V0 happens although PersonY actually enjoy the experience. When the eventuality V? happens, the eventuality V0 can happen. What is the eventuality V? ?","<span style=""color:red;"">the eventuality V0</span> happens although <span style=""color:red;"">PersonY actually enjoy the experience</span>. When <span style=""color:red;"">the eventuality V?</span> happens, <span style=""color:red;"">the eventuality V0</span> can happen. What is the eventuality V? ?","When PersonY would say something happens, PersonY probably would not have can happen. PersonY probably would not have happens although PersonY actually enjoy the experience.","When <span style=""color:red;"">PersonY would say something</span> happens, <span style=""color:red;"">PersonY probably would not have</span> can happen. <span style=""color:red;"">PersonY probably would not have</span> happens although <span style=""color:red;"">PersonY actually enjoy the experience</span>.",yes,no
23,"(p,(Condition),(p,(Concession),(e,(PersonY actually enjoy the experience))))",PersonY never meet PersonX,"['PersonY actually enjoy the experience', 'PersonY probably would not have', 'PersonY never meet PersonX']",20220408-210125-batch-0-q-23.png,20220408-210125-batch-0-a-23.png,Concession,2p,"the eventuality V0 happens although PersonY actually enjoy the experience. When the eventuality V? happens, the eventuality V0 can happen. What is the eventuality V? ?","<span style=""color:red;"">the eventuality V0</span> happens although <span style=""color:red;"">PersonY actually enjoy the experience</span>. When <span style=""color:red;"">the eventuality V?</span> happens, <span style=""color:red;"">the eventuality V0</span> can happen. What is the eventuality V? ?","When PersonY never meet PersonX happens, PersonY probably would not have can happen. PersonY probably would not have happens although PersonY actually enjoy the experience.","When <span style=""color:red;"">PersonY never meet PersonX</span> happens, <span style=""color:red;"">PersonY probably would not have</span> can happen. <span style=""color:red;"">PersonY probably would not have</span> happens although <span style=""color:red;"">PersonY actually enjoy the experience</span>.",yes,no
