index,query,answer,subgraph_nodes,query_fig_name,answer_fig_name,main_relation,query_type,query_text,query_html,explanation_text,explanation_html
94,"(p,(Result),(i,(p,(Succession),(e,(PeopleX do not charge PersonY for the))),(p,(Reason),(e,(it be a stupid business decision)))))",PeopleX do the next best thing,"['PeopleX could not do it', 'PeopleX do not charge PersonY for the', 'it be a stupid business decision', 'PeopleX do the next best thing']",20220420-174733-batch-0-q-94.jpg,20220420-174733-batch-0-a-94.jpg,Succession,ip,PeopleX do not charge PersonY for the happens after the event V1. the event V1 result in the event V?. it be a stupid business decision happens because the event V1. What is the event V? ?,"<span style=""color:red;"">PeopleX do not charge PersonY for the</span> happens after <span style=""color:red;"">the event V1</span>. <span style=""color:red;"">the event V1</span> result in <span style=""color:red;"">the event V?</span>. <span style=""color:red;"">it be a stupid business decision</span> happens because <span style=""color:red;"">the event V1</span>. What is the event V? ?",PeopleX could not do it result in PeopleX do the next best thing. PeopleX do not charge PersonY for the happens after PeopleX could not do it. it be a stupid business decision happens because PeopleX could not do it.,"<span style=""color:red;"">PeopleX could not do it</span> result in <span style=""color:red;"">PeopleX do the next best thing</span>. <span style=""color:red;"">PeopleX do not charge PersonY for the</span> happens after <span style=""color:red;"">PeopleX could not do it</span>. <span style=""color:red;"">it be a stupid business decision</span> happens because <span style=""color:red;"">PeopleX could not do it</span>."
95,"(p,(Result),(i,(p,(Succession),(e,(PeopleX do not charge PersonY for the))),(p,(Reason),(e,(it be a stupid business decision)))))",it be time for change,"['PeopleX could not do it', 'PeopleX do not charge PersonY for the', 'it be a stupid business decision', 'it be time for change']",20220420-174733-batch-0-q-95.jpg,20220420-174733-batch-0-a-95.jpg,Succession,ip,PeopleX do not charge PersonY for the happens after the event V1. the event V1 result in the event V?. it be a stupid business decision happens because the event V1. What is the event V? ?,"<span style=""color:red;"">PeopleX do not charge PersonY for the</span> happens after <span style=""color:red;"">the event V1</span>. <span style=""color:red;"">the event V1</span> result in <span style=""color:red;"">the event V?</span>. <span style=""color:red;"">it be a stupid business decision</span> happens because <span style=""color:red;"">the event V1</span>. What is the event V? ?",PeopleX could not do it result in it be time for change. PeopleX do not charge PersonY for the happens after PeopleX could not do it. it be a stupid business decision happens because PeopleX could not do it.,"<span style=""color:red;"">PeopleX could not do it</span> result in <span style=""color:red;"">it be time for change</span>. <span style=""color:red;"">PeopleX do not charge PersonY for the</span> happens after <span style=""color:red;"">PeopleX could not do it</span>. <span style=""color:red;"">it be a stupid business decision</span> happens because <span style=""color:red;"">PeopleX could not do it</span>."
96,"(p,(Result),(i,(p,(Succession),(e,(PeopleX do not charge PersonY for the))),(p,(Reason),(e,(it be a stupid business decision)))))",PeopleY have to move,"['PeopleX could not do it', 'PeopleX do not charge PersonY for the', 'it be a stupid business decision', 'PeopleY have to move']",20220420-174733-batch-0-q-96.jpg,20220420-174733-batch-0-a-96.jpg,Succession,ip,PeopleX do not charge PersonY for the happens after the event V1. the event V1 result in the event V?. it be a stupid business decision happens because the event V1. What is the event V? ?,"<span style=""color:red;"">PeopleX do not charge PersonY for the</span> happens after <span style=""color:red;"">the event V1</span>. <span style=""color:red;"">the event V1</span> result in <span style=""color:red;"">the event V?</span>. <span style=""color:red;"">it be a stupid business decision</span> happens because <span style=""color:red;"">the event V1</span>. What is the event V? ?",PeopleX could not do it result in PeopleY have to move. PeopleX do not charge PersonY for the happens after PeopleX could not do it. it be a stupid business decision happens because PeopleX could not do it.,"<span style=""color:red;"">PeopleX could not do it</span> result in <span style=""color:red;"">PeopleY have to move</span>. <span style=""color:red;"">PeopleX do not charge PersonY for the</span> happens after <span style=""color:red;"">PeopleX could not do it</span>. <span style=""color:red;"">it be a stupid business decision</span> happens because <span style=""color:red;"">PeopleX could not do it</span>."
97,"(p,(Condition),(i,(p,(Alternative),(e,(PersonY have to end to do the right thing))),(p,(Reason),(e,(PersonY do not need to do PersonY work)))))",PersonY will only send PersonX,"['PersonX will do it for PersonY', 'PersonY do not need to do PersonY work', 'PersonY have to end to do the right thing', 'PersonY will only send PersonX']",20220420-174733-batch-0-q-97.jpg,20220420-174733-batch-0-a-97.jpg,Alternative,ip,"PersonY have to end to do the right thing is an alternative situation to the event V1. When the event V? happens, the event V1 can happen. PersonY do not need to do PersonY work happens because the event V1. What is the event V? ?","<span style=""color:red;"">PersonY have to end to do the right thing</span> is an alternative situation to <span style=""color:red;"">the event V1</span>. When <span style=""color:red;"">the event V?</span> happens, <span style=""color:red;"">the event V1</span> can happen. <span style=""color:red;"">PersonY do not need to do PersonY work</span> happens because <span style=""color:red;"">the event V1</span>. What is the event V? ?","PersonY do not need to do PersonY work happens because PersonX will do it for PersonY. When PersonY will only send PersonX happens, PersonX will do it for PersonY can happen. PersonY have to end to do the right thing is an alternative situation to PersonX will do it for PersonY.","<span style=""color:red;"">PersonY do not need to do PersonY work</span> happens because <span style=""color:red;"">PersonX will do it for PersonY</span>. When <span style=""color:red;"">PersonY will only send PersonX</span> happens, <span style=""color:red;"">PersonX will do it for PersonY</span> can happen. <span style=""color:red;"">PersonY have to end to do the right thing</span> is an alternative situation to <span style=""color:red;"">PersonX will do it for PersonY</span>."
98,"(p,(Condition),(i,(p,(Alternative),(e,(PersonY have to end to do the right thing))),(p,(Reason),(e,(PersonY do not need to do PersonY work)))))",PersonY have the thing,"['PersonX will do it for PersonY', 'PersonY do not need to do PersonY work', 'PersonY have to end to do the right thing', 'PersonY have the thing']",20220420-174733-batch-0-q-98.jpg,20220420-174733-batch-0-a-98.jpg,Alternative,ip,"PersonY have to end to do the right thing is an alternative situation to the event V1. When the event V? happens, the event V1 can happen. PersonY do not need to do PersonY work happens because the event V1. What is the event V? ?","<span style=""color:red;"">PersonY have to end to do the right thing</span> is an alternative situation to <span style=""color:red;"">the event V1</span>. When <span style=""color:red;"">the event V?</span> happens, <span style=""color:red;"">the event V1</span> can happen. <span style=""color:red;"">PersonY do not need to do PersonY work</span> happens because <span style=""color:red;"">the event V1</span>. What is the event V? ?","PersonY do not need to do PersonY work happens because PersonX will do it for PersonY. When PersonY have the thing happens, PersonX will do it for PersonY can happen. PersonY have to end to do the right thing is an alternative situation to PersonX will do it for PersonY.","<span style=""color:red;"">PersonY do not need to do PersonY work</span> happens because <span style=""color:red;"">PersonX will do it for PersonY</span>. When <span style=""color:red;"">PersonY have the thing</span> happens, <span style=""color:red;"">PersonX will do it for PersonY</span> can happen. <span style=""color:red;"">PersonY have to end to do the right thing</span> is an alternative situation to <span style=""color:red;"">PersonX will do it for PersonY</span>."
99,"(p,(Condition),(i,(p,(Alternative),(e,(PersonY have to end to do the right thing))),(p,(Reason),(e,(PersonY do not need to do PersonY work)))))",the bot do not,"['PersonX will do it for PersonY', 'PersonY do not need to do PersonY work', 'PersonY have to end to do the right thing', 'the bot do not']",20220420-174733-batch-0-q-99.jpg,20220420-174733-batch-0-a-99.jpg,Alternative,ip,"PersonY have to end to do the right thing is an alternative situation to the event V1. When the event V? happens, the event V1 can happen. PersonY do not need to do PersonY work happens because the event V1. What is the event V? ?","<span style=""color:red;"">PersonY have to end to do the right thing</span> is an alternative situation to <span style=""color:red;"">the event V1</span>. When <span style=""color:red;"">the event V?</span> happens, <span style=""color:red;"">the event V1</span> can happen. <span style=""color:red;"">PersonY do not need to do PersonY work</span> happens because <span style=""color:red;"">the event V1</span>. What is the event V? ?","PersonY do not need to do PersonY work happens because PersonX will do it for PersonY. When the bot do not happens, PersonX will do it for PersonY can happen. PersonY have to end to do the right thing is an alternative situation to PersonX will do it for PersonY.","<span style=""color:red;"">PersonY do not need to do PersonY work</span> happens because <span style=""color:red;"">PersonX will do it for PersonY</span>. When <span style=""color:red;"">the bot do not</span> happens, <span style=""color:red;"">PersonX will do it for PersonY</span> can happen. <span style=""color:red;"">PersonY have to end to do the right thing</span> is an alternative situation to <span style=""color:red;"">PersonX will do it for PersonY</span>."
100,"(p,(Reason),(i,(p,(Result),(e,(PersonX do not want to move room))),(p,(Reason),(e,(PersonX would not blame PersonY)))))",PersonY be like a father to PersonX,"['PersonX put up with it', 'PersonX would not blame PersonY', 'PersonX do not want to move room', 'PersonY be like a father to PersonX']",20220420-174733-batch-0-q-100.jpg,20220420-174733-batch-0-a-100.jpg,Result,ip,PersonX do not want to move room result in the event V1. the event V1 happens because the event V?. PersonX would not blame PersonY happens because the event V1. What is the event V? ?,"<span style=""color:red;"">PersonX do not want to move room</span> result in <span style=""color:red;"">the event V1</span>. <span style=""color:red;"">the event V1</span> happens because <span style=""color:red;"">the event V?</span>. <span style=""color:red;"">PersonX would not blame PersonY</span> happens because <span style=""color:red;"">the event V1</span>. What is the event V? ?",PersonX would not blame PersonY happens because PersonX put up with it. PersonX put up with it happens because PersonY be like a father to PersonX. PersonX do not want to move room result in PersonX put up with it.,"<span style=""color:red;"">PersonX would not blame PersonY</span> happens because <span style=""color:red;"">PersonX put up with it</span>. <span style=""color:red;"">PersonX put up with it</span> happens because <span style=""color:red;"">PersonY be like a father to PersonX</span>. <span style=""color:red;"">PersonX do not want to move room</span> result in <span style=""color:red;"">PersonX put up with it</span>."
101,"(p,(Reason),(i,(p,(Result),(e,(PersonX do not want to move room))),(p,(Reason),(e,(PersonX would not blame PersonY)))))",PersonX do not want to lose,"['PersonX put up with it', 'PersonX would not blame PersonY', 'PersonX do not want to move room', 'PersonX do not want to lose']",20220420-174733-batch-0-q-101.jpg,20220420-174733-batch-0-a-101.jpg,Result,ip,PersonX do not want to move room result in the event V1. the event V1 happens because the event V?. PersonX would not blame PersonY happens because the event V1. What is the event V? ?,"<span style=""color:red;"">PersonX do not want to move room</span> result in <span style=""color:red;"">the event V1</span>. <span style=""color:red;"">the event V1</span> happens because <span style=""color:red;"">the event V?</span>. <span style=""color:red;"">PersonX would not blame PersonY</span> happens because <span style=""color:red;"">the event V1</span>. What is the event V? ?",PersonX would not blame PersonY happens because PersonX put up with it. PersonX put up with it happens because PersonX do not want to lose. PersonX do not want to move room result in PersonX put up with it.,"<span style=""color:red;"">PersonX would not blame PersonY</span> happens because <span style=""color:red;"">PersonX put up with it</span>. <span style=""color:red;"">PersonX put up with it</span> happens because <span style=""color:red;"">PersonX do not want to lose</span>. <span style=""color:red;"">PersonX do not want to move room</span> result in <span style=""color:red;"">PersonX put up with it</span>."
102,"(p,(Reason),(i,(p,(Result),(e,(PersonX do not want to move room))),(p,(Reason),(e,(PersonX would not blame PersonY)))))",PersonX do not have any other choice,"['PersonX put up with it', 'PersonX would not blame PersonY', 'PersonX do not want to move room', 'PersonX do not have any other choice']",20220420-174733-batch-0-q-102.jpg,20220420-174733-batch-0-a-102.jpg,Result,ip,PersonX do not want to move room result in the event V1. the event V1 happens because the event V?. PersonX would not blame PersonY happens because the event V1. What is the event V? ?,"<span style=""color:red;"">PersonX do not want to move room</span> result in <span style=""color:red;"">the event V1</span>. <span style=""color:red;"">the event V1</span> happens because <span style=""color:red;"">the event V?</span>. <span style=""color:red;"">PersonX would not blame PersonY</span> happens because <span style=""color:red;"">the event V1</span>. What is the event V? ?",PersonX would not blame PersonY happens because PersonX put up with it. PersonX put up with it happens because PersonX do not have any other choice. PersonX do not want to move room result in PersonX put up with it.,"<span style=""color:red;"">PersonX would not blame PersonY</span> happens because <span style=""color:red;"">PersonX put up with it</span>. <span style=""color:red;"">PersonX put up with it</span> happens because <span style=""color:red;"">PersonX do not have any other choice</span>. <span style=""color:red;"">PersonX do not want to move room</span> result in <span style=""color:red;"">PersonX put up with it</span>."
103,"(p,(Result),(i,(p,(Precedence),(e,(PersonY have to ask for PeopleX))),(p,(Restatement),(e,(PersonY steal a look at PersonX)))))",PersonY ask PersonX to repeat,"['PersonY have ask for something', 'PersonY have to ask for PeopleX', 'PersonY steal a look at PersonX', 'PersonY ask PersonX to repeat']",20220420-174733-batch-0-q-103.jpg,20220420-174733-batch-0-a-103.jpg,Restatement,ip,PersonY have to ask for PeopleX happens before the event V1. the event V1 result in the event V?. the event V1 restates PersonY steal a look at PersonX. What is the event V? ?,"<span style=""color:red;"">PersonY have to ask for PeopleX</span> happens before <span style=""color:red;"">the event V1</span>. <span style=""color:red;"">the event V1</span> result in <span style=""color:red;"">the event V?</span>. <span style=""color:red;"">the event V1</span> restates <span style=""color:red;"">PersonY steal a look at PersonX</span>. What is the event V? ?",PersonY have to ask for PeopleX happens before PersonY have ask for something. PersonY have ask for something restates PersonY steal a look at PersonX. PersonY have ask for something result in PersonY ask PersonX to repeat.,"<span style=""color:red;"">PersonY have to ask for PeopleX</span> happens before <span style=""color:red;"">PersonY have ask for something</span>. <span style=""color:red;"">PersonY have ask for something</span> restates <span style=""color:red;"">PersonY steal a look at PersonX</span>. <span style=""color:red;"">PersonY have ask for something</span> result in <span style=""color:red;"">PersonY ask PersonX to repeat</span>."
104,"(p,(Condition),(i,(p,(Concession),(e,(PersonX do not reccomend))),(p,(Result),(e,(PersonY be go to fuck up PersonY brain)))))",PersonY can not listen to radio,"['PersonX do not reccomend', 'PersonY be go to fuck up PersonY brain', 'PersonY will be bore', 'PersonY can not listen to radio']",20220420-174733-batch-0-q-104.jpg,20220420-174733-batch-0-a-104.jpg,Concession,ip,"the event V1 happens although PersonX do not reccomend. When the event V? happens, the event V1 can happen. PersonY be go to fuck up PersonY brain result in the event V1. What is the event V? ?","<span style=""color:red;"">the event V1</span> happens although <span style=""color:red;"">PersonX do not reccomend</span>. When <span style=""color:red;"">the event V?</span> happens, <span style=""color:red;"">the event V1</span> can happen. <span style=""color:red;"">PersonY be go to fuck up PersonY brain</span> result in <span style=""color:red;"">the event V1</span>. What is the event V? ?","PersonY will be bore happens although PersonX do not reccomend. PersonY be go to fuck up PersonY brain result in PersonY will be bore. When PersonY can not listen to radio happens, PersonY will be bore can happen.","<span style=""color:red;"">PersonY will be bore</span> happens although <span style=""color:red;"">PersonX do not reccomend</span>. <span style=""color:red;"">PersonY be go to fuck up PersonY brain</span> result in <span style=""color:red;"">PersonY will be bore</span>. When <span style=""color:red;"">PersonY can not listen to radio</span> happens, <span style=""color:red;"">PersonY will be bore</span> can happen."
105,"(p,(Condition),(i,(p,(Concession),(e,(PersonX do not reccomend))),(p,(Result),(e,(PersonY be go to fuck up PersonY brain)))))",PersonY do not take PersonX advice,"['PersonX do not reccomend', 'PersonY be go to fuck up PersonY brain', 'PersonY will be bore', 'PersonY do not take PersonX advice']",20220420-174733-batch-0-q-105.jpg,20220420-174733-batch-0-a-105.jpg,Concession,ip,"the event V1 happens although PersonX do not reccomend. When the event V? happens, the event V1 can happen. PersonY be go to fuck up PersonY brain result in the event V1. What is the event V? ?","<span style=""color:red;"">the event V1</span> happens although <span style=""color:red;"">PersonX do not reccomend</span>. When <span style=""color:red;"">the event V?</span> happens, <span style=""color:red;"">the event V1</span> can happen. <span style=""color:red;"">PersonY be go to fuck up PersonY brain</span> result in <span style=""color:red;"">the event V1</span>. What is the event V? ?","PersonY will be bore happens although PersonX do not reccomend. PersonY be go to fuck up PersonY brain result in PersonY will be bore. When PersonY do not take PersonX advice happens, PersonY will be bore can happen.","<span style=""color:red;"">PersonY will be bore</span> happens although <span style=""color:red;"">PersonX do not reccomend</span>. <span style=""color:red;"">PersonY be go to fuck up PersonY brain</span> result in <span style=""color:red;"">PersonY will be bore</span>. When <span style=""color:red;"">PersonY do not take PersonX advice</span> happens, <span style=""color:red;"">PersonY will be bore</span> can happen."
106,"(p,(Condition),(i,(p,(Concession),(e,(PersonX do not reccomend))),(p,(Result),(e,(PersonY be go to fuck up PersonY brain)))))",PersonX join PersonY,"['PersonX do not reccomend', 'PersonY be go to fuck up PersonY brain', 'PersonY will be bore', 'PersonX join PersonY']",20220420-174733-batch-0-q-106.jpg,20220420-174733-batch-0-a-106.jpg,Concession,ip,"the event V1 happens although PersonX do not reccomend. When the event V? happens, the event V1 can happen. PersonY be go to fuck up PersonY brain result in the event V1. What is the event V? ?","<span style=""color:red;"">the event V1</span> happens although <span style=""color:red;"">PersonX do not reccomend</span>. When <span style=""color:red;"">the event V?</span> happens, <span style=""color:red;"">the event V1</span> can happen. <span style=""color:red;"">PersonY be go to fuck up PersonY brain</span> result in <span style=""color:red;"">the event V1</span>. What is the event V? ?","PersonY will be bore happens although PersonX do not reccomend. PersonY be go to fuck up PersonY brain result in PersonY will be bore. When PersonX join PersonY happens, PersonY will be bore can happen.","<span style=""color:red;"">PersonY will be bore</span> happens although <span style=""color:red;"">PersonX do not reccomend</span>. <span style=""color:red;"">PersonY be go to fuck up PersonY brain</span> result in <span style=""color:red;"">PersonY will be bore</span>. When <span style=""color:red;"">PersonX join PersonY</span> happens, <span style=""color:red;"">PersonY will be bore</span> can happen."
107,"(p,(Exception),(i,(p,(Concession),(e,(PersonY have lunch twice))),(p,(Concession),(e,(PersonX have a different meal)))))",PersonX have bacon,"['PeopleX have the same food', 'PersonX have a different meal', 'PersonY have lunch twice', 'PersonX have bacon']",20220420-174733-batch-0-q-107.jpg,20220420-174733-batch-0-a-107.jpg,Exception,ip,the event V1 happens although PersonY have lunch twice. the event V? is an exception of the event V1. the event V1 happens although PersonX have a different meal. What is the event V? ?,"<span style=""color:red;"">the event V1</span> happens although <span style=""color:red;"">PersonY have lunch twice</span>. <span style=""color:red;"">the event V?</span> is an exception of <span style=""color:red;"">the event V1</span>. <span style=""color:red;"">the event V1</span> happens although <span style=""color:red;"">PersonX have a different meal</span>. What is the event V? ?",PersonX have bacon is an exception of PeopleX have the same food. PeopleX have the same food happens although PersonX have a different meal. PeopleX have the same food happens although PersonY have lunch twice.,"<span style=""color:red;"">PersonX have bacon</span> is an exception of <span style=""color:red;"">PeopleX have the same food</span>. <span style=""color:red;"">PeopleX have the same food</span> happens although <span style=""color:red;"">PersonX have a different meal</span>. <span style=""color:red;"">PeopleX have the same food</span> happens although <span style=""color:red;"">PersonY have lunch twice</span>."
108,"(p,(Exception),(i,(p,(Concession),(e,(PersonY have lunch twice))),(p,(Concession),(e,(PersonX have a different meal)))))",PersonY have bacon,"['PeopleX have the same food', 'PersonX have a different meal', 'PersonY have lunch twice', 'PersonY have bacon']",20220420-174733-batch-0-q-108.jpg,20220420-174733-batch-0-a-108.jpg,Exception,ip,the event V1 happens although PersonY have lunch twice. the event V? is an exception of the event V1. the event V1 happens although PersonX have a different meal. What is the event V? ?,"<span style=""color:red;"">the event V1</span> happens although <span style=""color:red;"">PersonY have lunch twice</span>. <span style=""color:red;"">the event V?</span> is an exception of <span style=""color:red;"">the event V1</span>. <span style=""color:red;"">the event V1</span> happens although <span style=""color:red;"">PersonX have a different meal</span>. What is the event V? ?",PersonY have bacon is an exception of PeopleX have the same food. PeopleX have the same food happens although PersonX have a different meal. PeopleX have the same food happens although PersonY have lunch twice.,"<span style=""color:red;"">PersonY have bacon</span> is an exception of <span style=""color:red;"">PeopleX have the same food</span>. <span style=""color:red;"">PeopleX have the same food</span> happens although <span style=""color:red;"">PersonX have a different meal</span>. <span style=""color:red;"">PeopleX have the same food</span> happens although <span style=""color:red;"">PersonY have lunch twice</span>."
