index,query,answer,subgraph_nodes,query_fig_name,answer_fig_name,main_relation,query_type,query_text,query_html,explanation_text,explanation_html,baseline_with_explanation,baseline_without_explanation
24,"(p,(ChosenAlternative),(p,(Contrast),(e,(PersonY could have call PersonX down))))",PeopleX have a band,"['PersonY could have call PersonX down', 'PeopleX do not have a dj', 'PeopleX have a band']",20220408-210125-batch-0-q-24.png,20220408-210125-batch-0-a-24.png,ChosenAlternative,2p,PersonY could have call PersonX down and the eventuality V0 share significant difference regarding some property. the eventuality V0 is a preferred alternative situation to the eventuality V?. What is the eventuality V? ?,"<span style=""color:red;"">PersonY could have call PersonX down</span> and <span style=""color:red;"">the eventuality V0</span> share significant difference regarding some property. <span style=""color:red;"">the eventuality V0</span> is a preferred alternative situation to <span style=""color:red;"">the eventuality V?</span>. What is the eventuality V? ?",PeopleX do not have a dj is a preferred alternative situation to PeopleX have a band. PersonY could have call PersonX down and PeopleX do not have a dj share significant difference regarding some property.,"<span style=""color:red;"">PeopleX do not have a dj</span> is a preferred alternative situation to <span style=""color:red;"">PeopleX have a band</span>. <span style=""color:red;"">PersonY could have call PersonX down</span> and <span style=""color:red;"">PeopleX do not have a dj</span> share significant difference regarding some property.",no,no
25,"(p,(Concession),(p,(Restatement),(e,(PersonX look up in face))))",PersonX have know PersonX life,"['PersonX look up in face', 'PersonX see PersonX for time', 'PersonX have know PersonX life']",20220408-210125-batch-0-q-25.png,20220408-210125-batch-0-a-25.png,Restatement,2p,the eventuality V0 restates PersonX look up in face. the eventuality V? happens although the eventuality V0. What is the eventuality V? ?,"<span style=""color:red;"">the eventuality V0</span> restates <span style=""color:red;"">PersonX look up in face</span>. <span style=""color:red;"">the eventuality V?</span> happens although <span style=""color:red;"">the eventuality V0</span>. What is the eventuality V? ?",PersonX have know PersonX life happens although PersonX see PersonX for time. PersonX see PersonX for time restates PersonX look up in face.,"<span style=""color:red;"">PersonX have know PersonX life</span> happens although <span style=""color:red;"">PersonX see PersonX for time</span>. <span style=""color:red;"">PersonX see PersonX for time</span> restates <span style=""color:red;"">PersonX look up in face</span>.",no,no
26,"(p,(Reason),(p,(Precedence),(e,(PersonX do not want to be a goody-goody))))",PeopleX do not end up in jail,"['PersonX do not want to be a goody-goody', 'PeopleX get away with it', 'PeopleX do not end up in jail']",20220408-210125-batch-0-q-26.png,20220408-210125-batch-0-a-26.png,Precedence,2p,PersonX do not want to be a goody-goody happens before the eventuality V0. the eventuality V0 happens because the eventuality V?. What is the eventuality V? ?,"<span style=""color:red;"">PersonX do not want to be a goody-goody</span> happens before <span style=""color:red;"">the eventuality V0</span>. <span style=""color:red;"">the eventuality V0</span> happens because <span style=""color:red;"">the eventuality V?</span>. What is the eventuality V? ?",PeopleX get away with it happens because PeopleX do not end up in jail. PersonX do not want to be a goody-goody happens before PeopleX get away with it. PersonX do not want to be a goody-goody and PeopleX get away with it both happen.,"<span style=""color:red;"">PeopleX get away with it</span> happens because <span style=""color:red;"">PeopleX do not end up in jail</span>. <span style=""color:red;"">PersonX do not want to be a goody-goody</span> happens before <span style=""color:red;"">PeopleX get away with it</span>. <span style=""color:red;"">PersonX do not want to be a goody-goody</span> and <span style=""color:red;"">PeopleX get away with it</span> both happen.",no,no
27,"(p,(Reason),(p,(Precedence),(e,(PersonX do not want to be a goody-goody))))",PeopleX have a monopoly,"['PersonX do not want to be a goody-goody', 'PeopleX get away with it', 'PeopleX have a monopoly']",20220408-210125-batch-0-q-27.png,20220408-210125-batch-0-a-27.png,Precedence,2p,PersonX do not want to be a goody-goody happens before the eventuality V0. the eventuality V0 happens because the eventuality V?. What is the eventuality V? ?,"<span style=""color:red;"">PersonX do not want to be a goody-goody</span> happens before <span style=""color:red;"">the eventuality V0</span>. <span style=""color:red;"">the eventuality V0</span> happens because <span style=""color:red;"">the eventuality V?</span>. What is the eventuality V? ?",PeopleX get away with it happens because PeopleX have a monopoly. PersonX do not want to be a goody-goody happens before PeopleX get away with it. PersonX do not want to be a goody-goody and PeopleX get away with it both happen.,"<span style=""color:red;"">PeopleX get away with it</span> happens because <span style=""color:red;"">PeopleX have a monopoly</span>. <span style=""color:red;"">PersonX do not want to be a goody-goody</span> happens before <span style=""color:red;"">PeopleX get away with it</span>. <span style=""color:red;"">PersonX do not want to be a goody-goody</span> and <span style=""color:red;"">PeopleX get away with it</span> both happen.",no,no
28,"(p,(Reason),(p,(Precedence),(e,(PersonX do not want to be a goody-goody))))",PersonX do not have much of choice,"['PersonX do not want to be a goody-goody', 'PeopleX get away with it', 'PersonX do not have much of choice']",20220408-210125-batch-0-q-28.png,20220408-210125-batch-0-a-28.png,Precedence,2p,PersonX do not want to be a goody-goody happens before the eventuality V0. the eventuality V0 happens because the eventuality V?. What is the eventuality V? ?,"<span style=""color:red;"">PersonX do not want to be a goody-goody</span> happens before <span style=""color:red;"">the eventuality V0</span>. <span style=""color:red;"">the eventuality V0</span> happens because <span style=""color:red;"">the eventuality V?</span>. What is the eventuality V? ?",PeopleX get away with it happens because PersonX do not have much of choice. PersonX do not want to be a goody-goody happens before PeopleX get away with it. PersonX do not want to be a goody-goody and PeopleX get away with it both happen.,"<span style=""color:red;"">PeopleX get away with it</span> happens because <span style=""color:red;"">PersonX do not have much of choice</span>. <span style=""color:red;"">PersonX do not want to be a goody-goody</span> happens before <span style=""color:red;"">PeopleX get away with it</span>. <span style=""color:red;"">PersonX do not want to be a goody-goody</span> and <span style=""color:red;"">PeopleX get away with it</span> both happen.",no,no
29,"(p,(Synchronous),(p,(Reason),(e,(PersonX can not find a new job))))",PersonX be in california,"['PersonX can not find a new job', 'no one want to work with PersonX', 'PersonX be in california']",20220408-210125-batch-0-q-29.png,20220408-210125-batch-0-a-29.png,Synchronous,2p,PersonX can not find a new job happens because the eventuality V0. the eventuality V0 happens the same time as the eventuality V?. What is the eventuality V? ?,"<span style=""color:red;"">PersonX can not find a new job</span> happens because <span style=""color:red;"">the eventuality V0</span>. <span style=""color:red;"">the eventuality V0</span> happens the same time as <span style=""color:red;"">the eventuality V?</span>. What is the eventuality V? ?",no one want to work with PersonX happens the same time as PersonX be in california. PersonX can not find a new job happens because no one want to work with PersonX.,"<span style=""color:red;"">no one want to work with PersonX</span> happens the same time as <span style=""color:red;"">PersonX be in california</span>. <span style=""color:red;"">PersonX can not find a new job</span> happens because <span style=""color:red;"">no one want to work with PersonX</span>.",no,no
30,"(p,(Condition),(p,(Synchronous),(e,(PersonY have have a gun))))",PersonX fuck with PersonY,"['PersonY have have a gun', 'PersonY will shoot PersonX', 'PersonX fuck with PersonY']",20220408-210125-batch-0-q-30.png,20220408-210125-batch-0-a-30.png,Synchronous,2p,"PersonY have have a gun happens the same time as the eventuality V0. When the eventuality V? happens, the eventuality V0 can happen. What is the eventuality V? ?","<span style=""color:red;"">PersonY have have a gun</span> happens the same time as <span style=""color:red;"">the eventuality V0</span>. When <span style=""color:red;"">the eventuality V?</span> happens, <span style=""color:red;"">the eventuality V0</span> can happen. What is the eventuality V? ?","When PersonX fuck with PersonY happens, PersonY will shoot PersonX can happen. PersonY have have a gun happens the same time as PersonY will shoot PersonX.","When <span style=""color:red;"">PersonX fuck with PersonY</span> happens, <span style=""color:red;"">PersonY will shoot PersonX</span> can happen. <span style=""color:red;"">PersonY have have a gun</span> happens the same time as <span style=""color:red;"">PersonY will shoot PersonX</span>.",yes,yes
31,"(p,(Condition),(p,(Synchronous),(e,(PersonY have have a gun))))",PersonX will not love PersonY,"['PersonY have have a gun', 'PersonY will shoot PersonX', 'PersonX will not love PersonY']",20220408-210125-batch-0-q-31.png,20220408-210125-batch-0-a-31.png,Synchronous,2p,"PersonY have have a gun happens the same time as the eventuality V0. When the eventuality V? happens, the eventuality V0 can happen. What is the eventuality V? ?","<span style=""color:red;"">PersonY have have a gun</span> happens the same time as <span style=""color:red;"">the eventuality V0</span>. When <span style=""color:red;"">the eventuality V?</span> happens, <span style=""color:red;"">the eventuality V0</span> can happen. What is the eventuality V? ?","When PersonX will not love PersonY happens, PersonY will shoot PersonX can happen. PersonY have have a gun happens the same time as PersonY will shoot PersonX.","When <span style=""color:red;"">PersonX will not love PersonY</span> happens, <span style=""color:red;"">PersonY will shoot PersonX</span> can happen. <span style=""color:red;"">PersonY have have a gun</span> happens the same time as <span style=""color:red;"">PersonY will shoot PersonX</span>.",no,no
32,"(p,(Condition),(p,(Synchronous),(e,(PersonY have have a gun))))",PersonX do not tell PersonY the truth,"['PersonY have have a gun', 'PersonY will shoot PersonX', 'PersonX do not tell PersonY the truth']",20220408-210125-batch-0-q-32.png,20220408-210125-batch-0-a-32.png,Synchronous,2p,"PersonY have have a gun happens the same time as the eventuality V0. When the eventuality V? happens, the eventuality V0 can happen. What is the eventuality V? ?","<span style=""color:red;"">PersonY have have a gun</span> happens the same time as <span style=""color:red;"">the eventuality V0</span>. When <span style=""color:red;"">the eventuality V?</span> happens, <span style=""color:red;"">the eventuality V0</span> can happen. What is the eventuality V? ?","When PersonX do not tell PersonY the truth happens, PersonY will shoot PersonX can happen. PersonY have have a gun happens the same time as PersonY will shoot PersonX.","When <span style=""color:red;"">PersonX do not tell PersonY the truth</span> happens, <span style=""color:red;"">PersonY will shoot PersonX</span> can happen. <span style=""color:red;"">PersonY have have a gun</span> happens the same time as <span style=""color:red;"">PersonY will shoot PersonX</span>.",yes,yes
33,"(p,(Reason),(p,(Reason),(e,(PersonX almost hit PersonY))))",PersonY do not have a phone,"['PersonX almost hit PersonY', 'PersonY would not give PersonX PersonY number', 'PersonY do not have a phone']",20220408-210125-batch-0-q-33.png,20220408-210125-batch-0-a-33.png,Reason,2p,PersonX almost hit PersonY happens because the eventuality V0. the eventuality V0 happens because the eventuality V?. What is the eventuality V? ?,"<span style=""color:red;"">PersonX almost hit PersonY</span> happens because <span style=""color:red;"">the eventuality V0</span>. <span style=""color:red;"">the eventuality V0</span> happens because <span style=""color:red;"">the eventuality V?</span>. What is the eventuality V? ?",PersonX almost hit PersonY happens because PersonY would not give PersonX PersonY number. PersonY would not give PersonX PersonY number happens because PersonY do not have a phone.,"<span style=""color:red;"">PersonX almost hit PersonY</span> happens because <span style=""color:red;"">PersonY would not give PersonX PersonY number</span>. <span style=""color:red;"">PersonY would not give PersonX PersonY number</span> happens because <span style=""color:red;"">PersonY do not have a phone</span>.",no,no
34,"(i,(p,(Alternative),(e,(eithershe lie to PersonX))),(p,(Condition),(e,(PersonY can easily find out))))",PersonX be lie to PersonY,"['PersonX be lie to PersonY', 'eithershe lie to PersonX', 'PersonY can easily find out']",20220408-210125-batch-0-q-34.png,20220408-210125-batch-0-a-34.png,Alternative,2i,"eithershe lie to PersonX is an alternative situation to the eventuality V?. When the eventuality V? happens, PersonY can easily find out can happen. What is the eventuality V? ?","<span style=""color:red;"">eithershe lie to PersonX</span> is an alternative situation to <span style=""color:red;"">the eventuality V?</span>. When <span style=""color:red;"">the eventuality V?</span> happens, <span style=""color:red;"">PersonY can easily find out</span> can happen. What is the eventuality V? ?","When PersonX be lie to PersonY happens, PersonY can easily find out can happen. eithershe lie to PersonX is an alternative situation to PersonX be lie to PersonY.","When <span style=""color:red;"">PersonX be lie to PersonY</span> happens, <span style=""color:red;"">PersonY can easily find out</span> can happen. <span style=""color:red;"">eithershe lie to PersonX</span> is an alternative situation to <span style=""color:red;"">PersonX be lie to PersonY</span>.",yes,no
35,"(i,(p,(Precedence),(e,(forgiveness must come from PersonX))),(p,(Precedence),(e,(forgiveness must first come from PersonY))))",it can come from god,"['it can come from god', 'forgiveness must first come from PersonY', 'forgiveness must come from PersonX']",20220408-210125-batch-0-q-35.png,20220408-210125-batch-0-a-35.png,Precedence,2i,forgiveness must come from PersonX happens before the eventuality V?. forgiveness must first come from PersonY happens before the eventuality V?. What is the eventuality V? ?,"<span style=""color:red;"">forgiveness must come from PersonX</span> happens before <span style=""color:red;"">the eventuality V?</span>. <span style=""color:red;"">forgiveness must first come from PersonY</span> happens before <span style=""color:red;"">the eventuality V?</span>. What is the eventuality V? ?",forgiveness must first come from PersonY happens before it can come from god. forgiveness must come from PersonX happens before it can come from god.,"<span style=""color:red;"">forgiveness must first come from PersonY</span> happens before <span style=""color:red;"">it can come from god</span>. <span style=""color:red;"">forgiveness must come from PersonX</span> happens before <span style=""color:red;"">it can come from god</span>.",no,no
36,"(i,(p,(Reason),(e,(PersonY do not want to say what))),(p,(Reason),(e,(PersonX do not want to say the name))))",it be a spoiler,"['it be a spoiler', 'PersonX do not want to say the name', 'PersonY do not want to say what']",20220408-210125-batch-0-q-36.png,20220408-210125-batch-0-a-36.png,Reason,2i,PersonY do not want to say what happens because the eventuality V?. PersonX do not want to say the name happens because the eventuality V?. What is the eventuality V? ?,"<span style=""color:red;"">PersonY do not want to say what</span> happens because <span style=""color:red;"">the eventuality V?</span>. <span style=""color:red;"">PersonX do not want to say the name</span> happens because <span style=""color:red;"">the eventuality V?</span>. What is the eventuality V? ?",PersonX do not want to say the name happens because it be a spoiler. PersonY do not want to say what happens because it be a spoiler.,"<span style=""color:red;"">PersonX do not want to say the name</span> happens because <span style=""color:red;"">it be a spoiler</span>. <span style=""color:red;"">PersonY do not want to say what</span> happens because <span style=""color:red;"">it be a spoiler</span>.",no,no
37,"(i,(p,(Alternative),(e,(it could be bad))),(p,(Alternative),(e,(way it could be bad))))",it could be good,"['it could be bad', 'way it could be bad', 'it could be good']",20220408-210125-batch-0-q-37.png,20220408-210125-batch-0-a-37.png,Alternative,2i,it could be bad is an alternative situation to the eventuality V?. way it could be bad is an alternative situation to the eventuality V?. What is the eventuality V? ?,"<span style=""color:red;"">it could be bad</span> is an alternative situation to <span style=""color:red;"">the eventuality V?</span>. <span style=""color:red;"">way it could be bad</span> is an alternative situation to <span style=""color:red;"">the eventuality V?</span>. What is the eventuality V? ?",it could be good is an alternative situation to it could be bad. it could be bad is an alternative situation to it could be good. way it could be bad is an alternative situation to it could be good.,"<span style=""color:red;"">it could be good</span> is an alternative situation to <span style=""color:red;"">it could be bad</span>. <span style=""color:red;"">it could be bad</span> is an alternative situation to <span style=""color:red;"">it could be good</span>. <span style=""color:red;"">way it could be bad</span> is an alternative situation to <span style=""color:red;"">it could be good</span>.",no,no
38,"(i,(p,(Contrast),(e,(PersonX voice be slightly tremulous))),(p,(Restatement),(e,(the word come thickly))))",PersonX speak with difficulty,"['PersonX voice be slightly tremulous', 'the word come thickly', 'PersonX speak with difficulty']",20220408-210125-batch-0-q-38.png,20220408-210125-batch-0-a-38.png,Restatement,2i,PersonX voice be slightly tremulous and the eventuality V? share significant difference regarding some property. the eventuality V? restates the word come thickly. What is the eventuality V? ?,"<span style=""color:red;"">PersonX voice be slightly tremulous</span> and <span style=""color:red;"">the eventuality V?</span> share significant difference regarding some property. <span style=""color:red;"">the eventuality V?</span> restates <span style=""color:red;"">the word come thickly</span>. What is the eventuality V? ?",PersonX speak with difficulty restates the word come thickly. PersonX voice be slightly tremulous and PersonX speak with difficulty share significant difference regarding some property.,"<span style=""color:red;"">PersonX speak with difficulty</span> restates <span style=""color:red;"">the word come thickly</span>. <span style=""color:red;"">PersonX voice be slightly tremulous</span> and <span style=""color:red;"">PersonX speak with difficulty</span> share significant difference regarding some property.",no,no
39,"(i,(p,(Reason),(e,(PersonX ask PersonY call PersonX back))),(p,(Condition),(e,(PersonY will hear from PersonX))))",PersonX do not hear from PersonY,"['PersonX ask PersonY call PersonX back', 'PersonX do not hear from PersonY', 'PersonY will hear from PersonX']",20220408-210125-batch-0-q-39.png,20220408-210125-batch-0-a-39.png,Condition,2i,"PersonX ask PersonY call PersonX back happens because the eventuality V?. When the eventuality V? happens, PersonY will hear from PersonX can happen. What is the eventuality V? ?","<span style=""color:red;"">PersonX ask PersonY call PersonX back</span> happens because <span style=""color:red;"">the eventuality V?</span>. When <span style=""color:red;"">the eventuality V?</span> happens, <span style=""color:red;"">PersonY will hear from PersonX</span> can happen. What is the eventuality V? ?","PersonX ask PersonY call PersonX back happens because PersonX do not hear from PersonY. When PersonX do not hear from PersonY happens, PersonY will hear from PersonX can happen.","<span style=""color:red;"">PersonX ask PersonY call PersonX back</span> happens because <span style=""color:red;"">PersonX do not hear from PersonY</span>. When <span style=""color:red;"">PersonX do not hear from PersonY</span> happens, <span style=""color:red;"">PersonY will hear from PersonX</span> can happen.",yes,no
40,"(i,(p,(Condition),(e,(PersonX do not want to believe PeopleX))),(p,(Reason),(e,(PersonX do not try to sell PersonY more))))",PersonY do not want to go back,"['PersonX do not try to sell PersonY more', 'PersonY do not want to go back', 'PersonX do not want to believe PeopleX']",20220408-210125-batch-0-q-40.png,20220408-210125-batch-0-a-40.png,Condition,2i,"When the eventuality V? happens, PersonX do not want to believe PeopleX can happen. PersonX do not try to sell PersonY more happens because the eventuality V?. What is the eventuality V? ?","When <span style=""color:red;"">the eventuality V?</span> happens, <span style=""color:red;"">PersonX do not want to believe PeopleX</span> can happen. <span style=""color:red;"">PersonX do not try to sell PersonY more</span> happens because <span style=""color:red;"">the eventuality V?</span>. What is the eventuality V? ?","When PersonY do not want to go back happens, PersonX do not want to believe PeopleX can happen. PersonX do not try to sell PersonY more happens because PersonY do not want to go back.","When <span style=""color:red;"">PersonY do not want to go back</span> happens, <span style=""color:red;"">PersonX do not want to believe PeopleX</span> can happen. <span style=""color:red;"">PersonX do not try to sell PersonY more</span> happens because <span style=""color:red;"">PersonY do not want to go back</span>.",no,no
41,"(i,(p,(Exception),(e,(PersonX will say nothing about it))),(p,(Reason),(e,(PersonX like yelp))))",it give PersonX a opportunity,"['PersonX like yelp', 'PersonX will say nothing about it', 'it give PersonX a opportunity']",20220408-210125-batch-0-q-41.png,20220408-210125-batch-0-a-41.png,Exception,2i,the eventuality V? is an exception of PersonX will say nothing about it. PersonX like yelp happens because the eventuality V?. What is the eventuality V? ?,"<span style=""color:red;"">the eventuality V?</span> is an exception of <span style=""color:red;"">PersonX will say nothing about it</span>. <span style=""color:red;"">PersonX like yelp</span> happens because <span style=""color:red;"">the eventuality V?</span>. What is the eventuality V? ?",PersonX like yelp happens because it give PersonX a opportunity. it give PersonX a opportunity is an exception of PersonX will say nothing about it.,"<span style=""color:red;"">PersonX like yelp</span> happens because <span style=""color:red;"">it give PersonX a opportunity</span>. <span style=""color:red;"">it give PersonX a opportunity</span> is an exception of <span style=""color:red;"">PersonX will say nothing about it</span>.",yes,no
42,"(i,(p,(ChosenAlternative),(e,(some culture do not recognize venus))),(p,(ChosenAlternative),(e,(the movement of venus appear to be discontinuous))))",PeopleX assume it be star on horizon,"['some culture do not recognize venus', 'PeopleX assume it be star on horizon', 'the movement of venus appear to be discontinuous']",20220408-210125-batch-0-q-42.png,20220408-210125-batch-0-a-42.png,ChosenAlternative,2i,some culture do not recognize venus is a preferred alternative situation to the eventuality V?. the movement of venus appear to be discontinuous is a preferred alternative situation to the eventuality V?. What is the eventuality V? ?,"<span style=""color:red;"">some culture do not recognize venus</span> is a preferred alternative situation to <span style=""color:red;"">the eventuality V?</span>. <span style=""color:red;"">the movement of venus appear to be discontinuous</span> is a preferred alternative situation to <span style=""color:red;"">the eventuality V?</span>. What is the eventuality V? ?",some culture do not recognize venus is a preferred alternative situation to PeopleX assume it be star on horizon. the movement of venus appear to be discontinuous is a preferred alternative situation to PeopleX assume it be star on horizon.,"<span style=""color:red;"">some culture do not recognize venus</span> is a preferred alternative situation to <span style=""color:red;"">PeopleX assume it be star on horizon</span>. <span style=""color:red;"">the movement of venus appear to be discontinuous</span> is a preferred alternative situation to <span style=""color:red;"">PeopleX assume it be star on horizon</span>.",no,no
