index,query,answer,subgraph_nodes,query_fig_name,answer_fig_name,main_relation,query_type,query_text,query_html,explanation_text,explanation_html
1,"(p,(Synchronous),(e,(PersonX will not tell PersonZ about PersonY)))",PersonY never exist at all,"['PersonX will not tell PersonZ about PersonY', 'PersonY never exist at all']",20220420-174733-batch-0-q-1.jpg,20220420-174733-batch-0-a-1.jpg,Synchronous,1p,PersonX will not tell PersonZ about PersonY happens the same time as the event V?. What is the event V? ?,"<span style=""color:red;"">PersonX will not tell PersonZ about PersonY</span> happens the same time as <span style=""color:red;"">the event V?</span>. What is the event V? ?",PersonX will not tell PersonZ about PersonY happens the same time as PersonY never exist at all.,"<span style=""color:red;"">PersonX will not tell PersonZ about PersonY</span> happens the same time as <span style=""color:red;"">PersonY never exist at all</span>."
2,"(p,(Conjunction),(e,(the richer get richer)))",the poor get poorer,"['the richer get richer', 'the poor get poorer']",20220420-174733-batch-0-q-2.jpg,20220420-174733-batch-0-a-2.jpg,Conjunction,1p,the richer get richer and the event V? both happen. What is the event V? ?,"<span style=""color:red;"">the richer get richer</span> and <span style=""color:red;"">the event V?</span> both happen. What is the event V? ?",the richer get richer and the poor get poorer both happen.,"<span style=""color:red;"">the richer get richer</span> and <span style=""color:red;"">the poor get poorer</span> both happen."
3,"(p,(Concession),(e,(PersonY will not comment on it)))",anything be a lie,"['PersonY will not comment on it', 'anything be a lie']",20220420-174733-batch-0-q-3.jpg,20220420-174733-batch-0-a-3.jpg,Concession,1p,the event V? happens although PersonY will not comment on it. What is the event V? ?,"<span style=""color:red;"">the event V?</span> happens although <span style=""color:red;"">PersonY will not comment on it</span>. What is the event V? ?",anything be a lie happens although PersonY will not comment on it.,"<span style=""color:red;"">anything be a lie</span> happens although <span style=""color:red;"">PersonY will not comment on it</span>."
4,"(p,(Alternative),(e,(PersonX get out of training)))",the result will be the same,"['PersonX get out of training', 'the result will be the same']",20220420-174733-batch-0-q-4.jpg,20220420-174733-batch-0-a-4.jpg,Alternative,1p,PersonX get out of training is an alternative situation to the event V?. What is the event V? ?,"<span style=""color:red;"">PersonX get out of training</span> is an alternative situation to <span style=""color:red;"">the event V?</span>. What is the event V? ?",PersonX get out of training is an alternative situation to the result will be the same.,"<span style=""color:red;"">PersonX get out of training</span> is an alternative situation to <span style=""color:red;"">the result will be the same</span>."
5,"(p,(Reason),(e,(PersonX best friend do not want to hang out with PersonX)))",PersonY do not like PersonX back,"['PersonX best friend do not want to hang out with PersonX', 'PersonY do not like PersonX back']",20220420-174733-batch-0-q-5.jpg,20220420-174733-batch-0-a-5.jpg,Reason,1p,PersonX best friend do not want to hang out with PersonX happens because the event V?. What is the event V? ?,"<span style=""color:red;"">PersonX best friend do not want to hang out with PersonX</span> happens because <span style=""color:red;"">the event V?</span>. What is the event V? ?",PersonX best friend do not want to hang out with PersonX happens because PersonY do not like PersonX back.,"<span style=""color:red;"">PersonX best friend do not want to hang out with PersonX</span> happens because <span style=""color:red;"">PersonY do not like PersonX back</span>."
6,"(p,(Conjunction),(e,(the time for deliberation have pass)))",the time for action have come,"['the time for deliberation have pass', 'the time for action have come']",20220420-174733-batch-0-q-6.jpg,20220420-174733-batch-0-a-6.jpg,Conjunction,1p,the time for deliberation have pass and the event V? both happen. What is the event V? ?,"<span style=""color:red;"">the time for deliberation have pass</span> and <span style=""color:red;"">the event V?</span> both happen. What is the event V? ?",the time for deliberation have pass and the time for action have come both happen.,"<span style=""color:red;"">the time for deliberation have pass</span> and <span style=""color:red;"">the time for action have come</span> both happen."
7,"(p,(Exception),(e,(PersonY actually have a valid point)))",it do not solve,"['PersonY actually have a valid point', 'it do not solve']",20220420-174733-batch-0-q-7.jpg,20220420-174733-batch-0-a-7.jpg,Exception,1p,the event V? is an exception of PersonY actually have a valid point. What is the event V? ?,"<span style=""color:red;"">the event V?</span> is an exception of <span style=""color:red;"">PersonY actually have a valid point</span>. What is the event V? ?",it do not solve is an exception of PersonY actually have a valid point.,"<span style=""color:red;"">it do not solve</span> is an exception of <span style=""color:red;"">PersonY actually have a valid point</span>."
8,"(p,(Exception),(e,(PersonY actually have a valid point)))",the problem pose,"['PersonY actually have a valid point', 'the problem pose']",20220420-174733-batch-0-q-8.jpg,20220420-174733-batch-0-a-8.jpg,Exception,1p,the event V? is an exception of PersonY actually have a valid point. What is the event V? ?,"<span style=""color:red;"">the event V?</span> is an exception of <span style=""color:red;"">PersonY actually have a valid point</span>. What is the event V? ?",the problem pose is an exception of PersonY actually have a valid point.,"<span style=""color:red;"">the problem pose</span> is an exception of <span style=""color:red;"">PersonY actually have a valid point</span>."
9,"(p,(Contrast),(e,(it be not even the beginning of end)))",it be the end of beginning,"['it be not even the beginning of end', 'it be the end of beginning']",20220420-174733-batch-0-q-9.jpg,20220420-174733-batch-0-a-9.jpg,Contrast,1p,it be not even the beginning of end and the event V? share significant difference regarding some property. What is the event V? ?,"<span style=""color:red;"">it be not even the beginning of end</span> and <span style=""color:red;"">the event V?</span> share significant difference regarding some property. What is the event V? ?",it be not even the beginning of end and it be the end of beginning share significant difference regarding some property.,"<span style=""color:red;"">it be not even the beginning of end</span> and <span style=""color:red;"">it be the end of beginning</span> share significant difference regarding some property."
10,"(p,(Instantiation),(e,(it have long be PersonY contention)))",the ground version cook a great deal,"['it have long be PersonY contention', 'the ground version cook a great deal']",20220420-174733-batch-0-q-10.jpg,20220420-174733-batch-0-a-10.jpg,Instantiation,1p,the event V? is a more detailed description of it have long be PersonY contention. What is the event V? ?,"<span style=""color:red;"">the event V?</span> is a more detailed description of <span style=""color:red;"">it have long be PersonY contention</span>. What is the event V? ?",the ground version cook a great deal is a more detailed description of it have long be PersonY contention.,"<span style=""color:red;"">the ground version cook a great deal</span> is a more detailed description of <span style=""color:red;"">it have long be PersonY contention</span>."
11,"(p,(Instantiation),(e,(it have long be PersonY contention)))",it fire the imagination,"['it have long be PersonY contention', 'it fire the imagination']",20220420-174733-batch-0-q-11.jpg,20220420-174733-batch-0-a-11.jpg,Instantiation,1p,the event V? is a more detailed description of it have long be PersonY contention. What is the event V? ?,"<span style=""color:red;"">the event V?</span> is a more detailed description of <span style=""color:red;"">it have long be PersonY contention</span>. What is the event V? ?",it fire the imagination is a more detailed description of it have long be PersonY contention.,"<span style=""color:red;"">it fire the imagination</span> is a more detailed description of <span style=""color:red;"">it have long be PersonY contention</span>."
12,"(p,(Synchronous),(e,(PersonX could even stand to be in the same room with PersonY)))",PersonY be PersonZ else,"['PersonX could even stand to be in the same room with PersonY', 'PersonY be PersonZ else']",20220420-174733-batch-0-q-12.jpg,20220420-174733-batch-0-a-12.jpg,Synchronous,1p,PersonX could even stand to be in the same room with PersonY happens the same time as the event V?. What is the event V? ?,"<span style=""color:red;"">PersonX could even stand to be in the same room with PersonY</span> happens the same time as <span style=""color:red;"">the event V?</span>. What is the event V? ?",PersonX could even stand to be in the same room with PersonY happens the same time as PersonY be PersonZ else.,"<span style=""color:red;"">PersonX could even stand to be in the same room with PersonY</span> happens the same time as <span style=""color:red;"">PersonY be PersonZ else</span>."
13,"(p,(ChosenAlternative),(e,(PersonX be go to downvote PersonY)))",PersonX be go to give,"['PersonX be go to downvote PersonY', 'PersonX be go to give']",20220420-174733-batch-0-q-13.jpg,20220420-174733-batch-0-a-13.jpg,ChosenAlternative,1p,PersonX be go to downvote PersonY is a preferred alternative situation to the event V?. What is the event V? ?,"<span style=""color:red;"">PersonX be go to downvote PersonY</span> is a preferred alternative situation to <span style=""color:red;"">the event V?</span>. What is the event V? ?",PersonX be go to downvote PersonY and PersonX be go to give share significant difference regarding some property. PersonX be go to downvote PersonY is a preferred alternative situation to PersonX be go to give.,"<span style=""color:red;"">PersonX be go to downvote PersonY</span> and <span style=""color:red;"">PersonX be go to give</span> share significant difference regarding some property. <span style=""color:red;"">PersonX be go to downvote PersonY</span> is a preferred alternative situation to <span style=""color:red;"">PersonX be go to give</span>."
14,"(p,(Result),(e,(PersonX could mute PeopleX)))",PersonX do not have to listen to PeopleX,"['PersonX could mute PeopleX', 'PersonX do not have to listen to PeopleX']",20220420-174733-batch-0-q-14.jpg,20220420-174733-batch-0-a-14.jpg,Result,1p,PersonX could mute PeopleX result in the event V?. What is the event V? ?,"<span style=""color:red;"">PersonX could mute PeopleX</span> result in <span style=""color:red;"">the event V?</span>. What is the event V? ?",PersonX could mute PeopleX result in PersonX do not have to listen to PeopleX.,"<span style=""color:red;"">PersonX could mute PeopleX</span> result in <span style=""color:red;"">PersonX do not have to listen to PeopleX</span>."
15,"(p,(Condition),(e,(PersonX would like to love PersonY)))",PersonY would let PersonX,"['PersonX would like to love PersonY', 'PersonY would let PersonX']",20220420-174733-batch-0-q-15.jpg,20220420-174733-batch-0-a-15.jpg,Condition,1p,"When the event V? happens, PersonX would like to love PersonY can happen. What is the event V? ?","When <span style=""color:red;"">the event V?</span> happens, <span style=""color:red;"">PersonX would like to love PersonY</span> can happen. What is the event V? ?","When PersonY would let PersonX happens, PersonX would like to love PersonY can happen.","When <span style=""color:red;"">PersonY would let PersonX</span> happens, <span style=""color:red;"">PersonX would like to love PersonY</span> can happen."
16,"(p,(Alternative),(e,(PersonX can go back to punxsutawney)))",PersonX can freeze to death,"['PersonX can go back to punxsutawney', 'PersonX can freeze to death']",20220420-174733-batch-0-q-16.jpg,20220420-174733-batch-0-a-16.jpg,Alternative,1p,PersonX can go back to punxsutawney is an alternative situation to the event V?. What is the event V? ?,"<span style=""color:red;"">PersonX can go back to punxsutawney</span> is an alternative situation to <span style=""color:red;"">the event V?</span>. What is the event V? ?",PersonX can go back to punxsutawney is an alternative situation to PersonX can freeze to death.,"<span style=""color:red;"">PersonX can go back to punxsutawney</span> is an alternative situation to <span style=""color:red;"">PersonX can freeze to death</span>."
17,"(p,(Alternative),(e,(PersonX can go back to punxsutawney)))",PersonX can go ahead,"['PersonX can go back to punxsutawney', 'PersonX can go ahead']",20220420-174733-batch-0-q-17.jpg,20220420-174733-batch-0-a-17.jpg,Alternative,1p,PersonX can go back to punxsutawney is an alternative situation to the event V?. What is the event V? ?,"<span style=""color:red;"">PersonX can go back to punxsutawney</span> is an alternative situation to <span style=""color:red;"">the event V?</span>. What is the event V? ?",PersonX can go back to punxsutawney is an alternative situation to PersonX can go ahead.,"<span style=""color:red;"">PersonX can go back to punxsutawney</span> is an alternative situation to <span style=""color:red;"">PersonX can go ahead</span>."
18,"(p,(Alternative),(e,(PersonX can go back to punxsutawney)))",PersonX freeze to death,"['PersonX can go back to punxsutawney', 'PersonX freeze to death']",20220420-174733-batch-0-q-18.jpg,20220420-174733-batch-0-a-18.jpg,Alternative,1p,PersonX can go back to punxsutawney is an alternative situation to the event V?. What is the event V? ?,"<span style=""color:red;"">PersonX can go back to punxsutawney</span> is an alternative situation to <span style=""color:red;"">the event V?</span>. What is the event V? ?",PersonX can go back to punxsutawney is an alternative situation to PersonX freeze to death.,"<span style=""color:red;"">PersonX can go back to punxsutawney</span> is an alternative situation to <span style=""color:red;"">PersonX freeze to death</span>."
19,"(p,(Condition),(e,(PeopleX will ask PersonY to dinner)))",PersonX will meet PersonY,"['PeopleX will ask PersonY to dinner', 'PersonX will meet PersonY']",20220420-174733-batch-0-q-19.jpg,20220420-174733-batch-0-a-19.jpg,Condition,1p,"When the event V? happens, PeopleX will ask PersonY to dinner can happen. What is the event V? ?","When <span style=""color:red;"">the event V?</span> happens, <span style=""color:red;"">PeopleX will ask PersonY to dinner</span> can happen. What is the event V? ?","When PersonX will meet PersonY happens, PeopleX will ask PersonY to dinner can happen.","When <span style=""color:red;"">PersonX will meet PersonY</span> happens, <span style=""color:red;"">PeopleX will ask PersonY to dinner</span> can happen."
20,"(p,(Concession),(p,(Result),(e,(PersonX can learn from PeopleX))))",PersonX do not know any other,"['PersonX can learn from PeopleX', 'PersonX will not repeat PeopleX', 'PersonX do not know any other']",20220420-174733-batch-0-q-20.jpg,20220420-174733-batch-0-a-20.jpg,Concession,2p,PersonX can learn from PeopleX result in the event V0. the event V? happens although the event V0. What is the event V? ?,"<span style=""color:red;"">PersonX can learn from PeopleX</span> result in <span style=""color:red;"">the event V0</span>. <span style=""color:red;"">the event V?</span> happens although <span style=""color:red;"">the event V0</span>. What is the event V? ?",PersonX can learn from PeopleX result in PersonX will not repeat PeopleX. PersonX do not know any other happens although PersonX will not repeat PeopleX.,"<span style=""color:red;"">PersonX can learn from PeopleX</span> result in <span style=""color:red;"">PersonX will not repeat PeopleX</span>. <span style=""color:red;"">PersonX do not know any other</span> happens although <span style=""color:red;"">PersonX will not repeat PeopleX</span>."
21,"(p,(Condition),(p,(Condition),(e,(it can happen to PersonY))))",it can happen to PersonX,"['it can happen to PersonY', 'it can happen to PeopleX', 'it can happen to PersonX']",20220420-174733-batch-0-q-21.jpg,20220420-174733-batch-0-a-21.jpg,Condition,2p,"When the event V0 happens, it can happen to PersonY can happen. When the event V? happens, the event V0 can happen. What is the event V? ?","When <span style=""color:red;"">the event V0</span> happens, <span style=""color:red;"">it can happen to PersonY</span> can happen. When <span style=""color:red;"">the event V?</span> happens, <span style=""color:red;"">the event V0</span> can happen. What is the event V? ?","When it can happen to PeopleX happens, it can happen to PersonX can happen. When it can happen to PersonY happens, it can happen to PersonX can happen. When it can happen to PersonX happens, it can happen to PeopleX can happen. When it can happen to PersonY happens, it can happen to PeopleX can happen. When it can happen to PeopleX happens, it can happen to PersonY can happen. When it can happen to PersonX happens, it can happen to PersonY can happen.","When <span style=""color:red;"">it can happen to PeopleX</span> happens, <span style=""color:red;"">it can happen to PersonX</span> can happen. When <span style=""color:red;"">it can happen to PersonY</span> happens, <span style=""color:red;"">it can happen to PersonX</span> can happen. When <span style=""color:red;"">it can happen to PersonX</span> happens, <span style=""color:red;"">it can happen to PeopleX</span> can happen. When <span style=""color:red;"">it can happen to PersonY</span> happens, <span style=""color:red;"">it can happen to PeopleX</span> can happen. When <span style=""color:red;"">it can happen to PeopleX</span> happens, <span style=""color:red;"">it can happen to PersonY</span> can happen. When <span style=""color:red;"">it can happen to PersonX</span> happens, <span style=""color:red;"">it can happen to PersonY</span> can happen."
23,"(p,(Condition),(p,(Condition),(e,(it can happen to PersonY))))",it can happen to PeopleX,"['it can happen to PersonY', 'it can happen to PersonX', 'it can happen to PeopleX']",20220420-174733-batch-0-q-23.jpg,20220420-174733-batch-0-a-23.jpg,Condition,2p,"When the event V0 happens, it can happen to PersonY can happen. When the event V? happens, the event V0 can happen. What is the event V? ?","When <span style=""color:red;"">the event V0</span> happens, <span style=""color:red;"">it can happen to PersonY</span> can happen. When <span style=""color:red;"">the event V?</span> happens, <span style=""color:red;"">the event V0</span> can happen. What is the event V? ?","When it can happen to PeopleX happens, it can happen to PersonX can happen. When it can happen to PersonY happens, it can happen to PersonX can happen. When it can happen to PersonX happens, it can happen to PeopleX can happen. When it can happen to PersonY happens, it can happen to PeopleX can happen. When it can happen to PeopleX happens, it can happen to PersonY can happen. When it can happen to PersonX happens, it can happen to PersonY can happen.","When <span style=""color:red;"">it can happen to PeopleX</span> happens, <span style=""color:red;"">it can happen to PersonX</span> can happen. When <span style=""color:red;"">it can happen to PersonY</span> happens, <span style=""color:red;"">it can happen to PersonX</span> can happen. When <span style=""color:red;"">it can happen to PersonX</span> happens, <span style=""color:red;"">it can happen to PeopleX</span> can happen. When <span style=""color:red;"">it can happen to PersonY</span> happens, <span style=""color:red;"">it can happen to PeopleX</span> can happen. When <span style=""color:red;"">it can happen to PeopleX</span> happens, <span style=""color:red;"">it can happen to PersonY</span> can happen. When <span style=""color:red;"">it can happen to PersonX</span> happens, <span style=""color:red;"">it can happen to PersonY</span> can happen."
24,"(p,(Restatement),(p,(Condition),(e,(PersonX would say go))))",it be of no interest to PersonX,"['PersonX would say go', 'PersonY can go to house', 'it be of no interest to PersonX']",20220420-174733-batch-0-q-24.jpg,20220420-174733-batch-0-a-24.jpg,Restatement,2p,"When the event V0 happens, PersonX would say go can happen. the event V? restates the event V0. What is the event V? ?","When <span style=""color:red;"">the event V0</span> happens, <span style=""color:red;"">PersonX would say go</span> can happen. <span style=""color:red;"">the event V?</span> restates <span style=""color:red;"">the event V0</span>. What is the event V? ?","When PersonY can go to house happens, PersonX would say go can happen. it be of no interest to PersonX restates PersonY can go to house.","When <span style=""color:red;"">PersonY can go to house</span> happens, <span style=""color:red;"">PersonX would say go</span> can happen. <span style=""color:red;"">it be of no interest to PersonX</span> restates <span style=""color:red;"">PersonY can go to house</span>."
25,"(p,(Precedence),(p,(Reason),(e,(PersonX PersonZ be interested))))",the wheel come off,"['PersonX PersonZ be interested', 'PersonY could play joe-fucking-hollywood', 'the wheel come off']",20220420-174733-batch-0-q-25.jpg,20220420-174733-batch-0-a-25.jpg,Precedence,2p,PersonX PersonZ be interested happens because the event V0. the event V0 happens before the event V?. What is the event V? ?,"<span style=""color:red;"">PersonX PersonZ be interested</span> happens because <span style=""color:red;"">the event V0</span>. <span style=""color:red;"">the event V0</span> happens before <span style=""color:red;"">the event V?</span>. What is the event V? ?",PersonY could play joe-fucking-hollywood happens before the wheel come off. PersonX PersonZ be interested happens because PersonY could play joe-fucking-hollywood.,"<span style=""color:red;"">PersonY could play joe-fucking-hollywood</span> happens before <span style=""color:red;"">the wheel come off</span>. <span style=""color:red;"">PersonX PersonZ be interested</span> happens because <span style=""color:red;"">PersonY could play joe-fucking-hollywood</span>."
26,"(p,(Conjunction),(p,(Conjunction),(e,(PersonX beat the soviet union))))",the cold war end,"['PersonX beat the soviet union', 'the soviet union collapse', 'the cold war end']",20220420-174733-batch-0-q-26.jpg,20220420-174733-batch-0-a-26.jpg,Conjunction,2p,PersonX beat the soviet union and the event V0 both happen. the event V0 and the event V? both happen. What is the event V? ?,"<span style=""color:red;"">PersonX beat the soviet union</span> and <span style=""color:red;"">the event V0</span> both happen. <span style=""color:red;"">the event V0</span> and <span style=""color:red;"">the event V?</span> both happen. What is the event V? ?",the cold war end and the soviet union collapse both happen. PersonX beat the soviet union and the soviet union collapse both happen. the soviet union collapse and the cold war end both happen.,"<span style=""color:red;"">the cold war end</span> and <span style=""color:red;"">the soviet union collapse</span> both happen. <span style=""color:red;"">PersonX beat the soviet union</span> and <span style=""color:red;"">the soviet union collapse</span> both happen. <span style=""color:red;"">the soviet union collapse</span> and <span style=""color:red;"">the cold war end</span> both happen."
27,"(p,(Conjunction),(p,(Conjunction),(e,(PersonX beat the soviet union))))",the berlin wall fall,"['PersonX beat the soviet union', 'the soviet union collapse', 'the berlin wall fall']",20220420-174733-batch-0-q-27.jpg,20220420-174733-batch-0-a-27.jpg,Conjunction,2p,PersonX beat the soviet union and the event V0 both happen. the event V0 and the event V? both happen. What is the event V? ?,"<span style=""color:red;"">PersonX beat the soviet union</span> and <span style=""color:red;"">the event V0</span> both happen. <span style=""color:red;"">the event V0</span> and <span style=""color:red;"">the event V?</span> both happen. What is the event V? ?",the berlin wall fall and the soviet union collapse both happen. PersonX beat the soviet union and the soviet union collapse both happen. the soviet union collapse and the berlin wall fall both happen.,"<span style=""color:red;"">the berlin wall fall</span> and <span style=""color:red;"">the soviet union collapse</span> both happen. <span style=""color:red;"">PersonX beat the soviet union</span> and <span style=""color:red;"">the soviet union collapse</span> both happen. <span style=""color:red;"">the soviet union collapse</span> and <span style=""color:red;"">the berlin wall fall</span> both happen."
28,"(p,(Conjunction),(p,(Conjunction),(e,(PersonX beat the soviet union))))",a civil war break out,"['PersonX beat the soviet union', 'the soviet union collapse', 'a civil war break out']",20220420-174733-batch-0-q-28.jpg,20220420-174733-batch-0-a-28.jpg,Conjunction,2p,PersonX beat the soviet union and the event V0 both happen. the event V0 and the event V? both happen. What is the event V? ?,"<span style=""color:red;"">PersonX beat the soviet union</span> and <span style=""color:red;"">the event V0</span> both happen. <span style=""color:red;"">the event V0</span> and <span style=""color:red;"">the event V?</span> both happen. What is the event V? ?",PersonX beat the soviet union and the soviet union collapse both happen. the soviet union collapse and a civil war break out both happen.,"<span style=""color:red;"">PersonX beat the soviet union</span> and <span style=""color:red;"">the soviet union collapse</span> both happen. <span style=""color:red;"">the soviet union collapse</span> and <span style=""color:red;"">a civil war break out</span> both happen."
