index,query,answer,subgraph_nodes,query_fig_name,answer_fig_name,main_relation,query_type,query_text,query_html,explanation_text,explanation_html,baseline_with_explanation,baseline_without_explanation
148,"(p,(Exception),(i,(p,(Condition),(e,(PersonX should just not answer))),(p,(Contrast),(e,(PersonX do not want to be disagreeable)))))",PersonY have a tooth,"['PersonX should just not answer', 'PersonX can not think of anything', 'PersonX do not want to be disagreeable', 'PersonY have a tooth']",20220401-194107_q148.png,20220401-194107_a148.png,Exception,ip,"When the eventuality V1 happens, PersonX should just not answer can happen. the eventuality V? is an exception of the eventuality V1. PersonX do not want to be disagreeable and the eventuality V1 share significant difference regarding some property. What is the eventuality V? ?","When <span style=""color:red;"">the eventuality V1</span> happens, <span style=""color:red;"">PersonX should just not answer</span> can happen. <span style=""color:red;"">the eventuality V?</span> is an exception of <span style=""color:red;"">the eventuality V1</span>. <span style=""color:red;"">PersonX do not want to be disagreeable</span> and <span style=""color:red;"">the eventuality V1</span> share significant difference regarding some property. What is the eventuality V? ?","PersonX do not want to be disagreeable and PersonX can not think of anything share significant difference regarding some property. When PersonX can not think of anything happens, PersonX should just not answer can happen. PersonY have a tooth is an exception of PersonX can not think of anything.","<span style=""color:red;"">PersonX do not want to be disagreeable</span> and <span style=""color:red;"">PersonX can not think of anything</span> share significant difference regarding some property. When <span style=""color:red;"">PersonX can not think of anything</span> happens, <span style=""color:red;"">PersonX should just not answer</span> can happen. <span style=""color:red;"">PersonY have a tooth</span> is an exception of <span style=""color:red;"">PersonX can not think of anything</span>.",yes,no
149,"(p,(Alternative),(i,(p,(Restatement),(e,(danny get the best of PersonY))),(p,(Contrast),(e,(PersonY have get the makings of fighter)))))",PersonY have a sure thing,"['PersonY have get the makings of fighter', 'danny get the best of PersonY', 'PersonY do not like to fight', 'PersonY have a sure thing']",20220401-194107_q149.png,20220401-194107_a149.png,Restatement,ip,the eventuality V1 restates danny get the best of PersonY. the eventuality V1 is an alternative situation to the eventuality V?. PersonY have get the makings of fighter and the eventuality V1 share significant difference regarding some property. What is the eventuality V? ?,"<span style=""color:red;"">the eventuality V1</span> restates <span style=""color:red;"">danny get the best of PersonY</span>. <span style=""color:red;"">the eventuality V1</span> is an alternative situation to <span style=""color:red;"">the eventuality V?</span>. <span style=""color:red;"">PersonY have get the makings of fighter</span> and <span style=""color:red;"">the eventuality V1</span> share significant difference regarding some property. What is the eventuality V? ?",PersonY do not like to fight restates danny get the best of PersonY. PersonY have get the makings of fighter and PersonY do not like to fight share significant difference regarding some property. PersonY do not like to fight is an alternative situation to PersonY have a sure thing.,"<span style=""color:red;"">PersonY do not like to fight</span> restates <span style=""color:red;"">danny get the best of PersonY</span>. <span style=""color:red;"">PersonY have get the makings of fighter</span> and <span style=""color:red;"">PersonY do not like to fight</span> share significant difference regarding some property. <span style=""color:red;"">PersonY do not like to fight</span> is an alternative situation to <span style=""color:red;"">PersonY have a sure thing</span>.",no,no
150,"(p,(Condition),(i,(p,(Conjunction),(e,(PersonX would die for PersonY))),(p,(Conjunction),(e,(PersonX would share it with PersonY)))))",PersonX have a social life,"['PersonX would die for PersonY', 'PersonX would share it with PersonY', 'PersonY would do the same for PersonX', 'PersonX have a social life']",20220401-194107_q150.png,20220401-194107_a150.png,Conjunction,ip,"PersonX would die for PersonY and the eventuality V1 both happen. When the eventuality V? happens, the eventuality V1 can happen. PersonX would share it with PersonY and the eventuality V1 both happen. What is the eventuality V? ?","<span style=""color:red;"">PersonX would die for PersonY</span> and <span style=""color:red;"">the eventuality V1</span> both happen. When <span style=""color:red;"">the eventuality V?</span> happens, <span style=""color:red;"">the eventuality V1</span> can happen. <span style=""color:red;"">PersonX would share it with PersonY</span> and <span style=""color:red;"">the eventuality V1</span> both happen. What is the eventuality V? ?","When PersonX have a social life happens, PersonY would do the same for PersonX can happen. PersonX would share it with PersonY and PersonY would do the same for PersonX both happen. PersonX would die for PersonY and PersonY would do the same for PersonX both happen.","When <span style=""color:red;"">PersonX have a social life</span> happens, <span style=""color:red;"">PersonY would do the same for PersonX</span> can happen. <span style=""color:red;"">PersonX would share it with PersonY</span> and <span style=""color:red;"">PersonY would do the same for PersonX</span> both happen. <span style=""color:red;"">PersonX would die for PersonY</span> and <span style=""color:red;"">PersonY would do the same for PersonX</span> both happen.",yes,yes
151,"(p,(Condition),(i,(p,(Conjunction),(e,(PersonX would die for PersonY))),(p,(Conjunction),(e,(PersonX would share it with PersonY)))))",the shoe be on the other foot,"['PersonX would die for PersonY', 'PersonX would share it with PersonY', 'PersonY would do the same for PersonX', 'the shoe be on the other foot']",20220401-194107_q151.png,20220401-194107_a151.png,Conjunction,ip,"PersonX would die for PersonY and the eventuality V1 both happen. When the eventuality V? happens, the eventuality V1 can happen. PersonX would share it with PersonY and the eventuality V1 both happen. What is the eventuality V? ?","<span style=""color:red;"">PersonX would die for PersonY</span> and <span style=""color:red;"">the eventuality V1</span> both happen. When <span style=""color:red;"">the eventuality V?</span> happens, <span style=""color:red;"">the eventuality V1</span> can happen. <span style=""color:red;"">PersonX would share it with PersonY</span> and <span style=""color:red;"">the eventuality V1</span> both happen. What is the eventuality V? ?","When the shoe be on the other foot happens, PersonY would do the same for PersonX can happen. PersonX would share it with PersonY and PersonY would do the same for PersonX both happen. PersonX would die for PersonY and PersonY would do the same for PersonX both happen.","When <span style=""color:red;"">the shoe be on the other foot</span> happens, <span style=""color:red;"">PersonY would do the same for PersonX</span> can happen. <span style=""color:red;"">PersonX would share it with PersonY</span> and <span style=""color:red;"">PersonY would do the same for PersonX</span> both happen. <span style=""color:red;"">PersonX would die for PersonY</span> and <span style=""color:red;"">PersonY would do the same for PersonX</span> both happen.",yes,yes
152,"(p,(Condition),(i,(p,(Conjunction),(e,(PersonX would die for PersonY))),(p,(Conjunction),(e,(PersonX would share it with PersonY)))))",PersonX need a favor,"['PersonX would die for PersonY', 'PersonX would share it with PersonY', 'PersonY would do the same for PersonX', 'PersonX need a favor']",20220401-194107_q152.png,20220401-194107_a152.png,Conjunction,ip,"PersonX would die for PersonY and the eventuality V1 both happen. When the eventuality V? happens, the eventuality V1 can happen. PersonX would share it with PersonY and the eventuality V1 both happen. What is the eventuality V? ?","<span style=""color:red;"">PersonX would die for PersonY</span> and <span style=""color:red;"">the eventuality V1</span> both happen. When <span style=""color:red;"">the eventuality V?</span> happens, <span style=""color:red;"">the eventuality V1</span> can happen. <span style=""color:red;"">PersonX would share it with PersonY</span> and <span style=""color:red;"">the eventuality V1</span> both happen. What is the eventuality V? ?","When PersonX need a favor happens, PersonY would do the same for PersonX can happen. PersonX would share it with PersonY and PersonY would do the same for PersonX both happen. PersonX would die for PersonY and PersonY would do the same for PersonX both happen.","When <span style=""color:red;"">PersonX need a favor</span> happens, <span style=""color:red;"">PersonY would do the same for PersonX</span> can happen. <span style=""color:red;"">PersonX would share it with PersonY</span> and <span style=""color:red;"">PersonY would do the same for PersonX</span> both happen. <span style=""color:red;"">PersonX would die for PersonY</span> and <span style=""color:red;"">PersonY would do the same for PersonX</span> both happen.",yes,yes
153,"(p,(Reason),(i,(p,(Reason),(e,(amber do not do anything))),(p,(Succession),(e,(it would not have be a relief for PersonX)))))",people believe in PersonX,"['it would not have be a relief for PersonX', 'amber do not do anything', 'PersonX do not exist', 'people believe in PersonX']",20220401-194107_q153.png,20220401-194107_a153.png,Succession,ip,amber do not do anything happens because the eventuality V1. the eventuality V1 happens because the eventuality V?. it would not have be a relief for PersonX happens after the eventuality V1. What is the eventuality V? ?,"<span style=""color:red;"">amber do not do anything</span> happens because <span style=""color:red;"">the eventuality V1</span>. <span style=""color:red;"">the eventuality V1</span> happens because <span style=""color:red;"">the eventuality V?</span>. <span style=""color:red;"">it would not have be a relief for PersonX</span> happens after <span style=""color:red;"">the eventuality V1</span>. What is the eventuality V? ?",amber do not do anything happens because PersonX do not exist. it would not have be a relief for PersonX happens after PersonX do not exist. PersonX do not exist happens because people believe in PersonX.,"<span style=""color:red;"">amber do not do anything</span> happens because <span style=""color:red;"">PersonX do not exist</span>. <span style=""color:red;"">it would not have be a relief for PersonX</span> happens after <span style=""color:red;"">PersonX do not exist</span>. <span style=""color:red;"">PersonX do not exist</span> happens because <span style=""color:red;"">people believe in PersonX</span>.",no,no
154,"(p,(Reason),(i,(p,(Reason),(e,(amber do not do anything))),(p,(Succession),(e,(it would not have be a relief for PersonX)))))",PersonY will not get a tip,"['it would not have be a relief for PersonX', 'amber do not do anything', 'PersonX do not exist', 'PersonY will not get a tip']",20220401-194107_q154.png,20220401-194107_a154.png,Succession,ip,amber do not do anything happens because the eventuality V1. the eventuality V1 happens because the eventuality V?. it would not have be a relief for PersonX happens after the eventuality V1. What is the eventuality V? ?,"<span style=""color:red;"">amber do not do anything</span> happens because <span style=""color:red;"">the eventuality V1</span>. <span style=""color:red;"">the eventuality V1</span> happens because <span style=""color:red;"">the eventuality V?</span>. <span style=""color:red;"">it would not have be a relief for PersonX</span> happens after <span style=""color:red;"">the eventuality V1</span>. What is the eventuality V? ?",amber do not do anything happens because PersonX do not exist. it would not have be a relief for PersonX happens after PersonX do not exist. PersonX do not exist happens because PersonY will not get a tip.,"<span style=""color:red;"">amber do not do anything</span> happens because <span style=""color:red;"">PersonX do not exist</span>. <span style=""color:red;"">it would not have be a relief for PersonX</span> happens after <span style=""color:red;"">PersonX do not exist</span>. <span style=""color:red;"">PersonX do not exist</span> happens because <span style=""color:red;"">PersonY will not get a tip</span>.",no,no
155,"(p,(Reason),(i,(p,(Reason),(e,(amber do not do anything))),(p,(Succession),(e,(it would not have be a relief for PersonX)))))",PersonX do exist,"['it would not have be a relief for PersonX', 'amber do not do anything', 'PersonX do not exist', 'PersonX do exist']",20220401-194107_q155.png,20220401-194107_a155.png,Succession,ip,amber do not do anything happens because the eventuality V1. the eventuality V1 happens because the eventuality V?. it would not have be a relief for PersonX happens after the eventuality V1. What is the eventuality V? ?,"<span style=""color:red;"">amber do not do anything</span> happens because <span style=""color:red;"">the eventuality V1</span>. <span style=""color:red;"">the eventuality V1</span> happens because <span style=""color:red;"">the eventuality V?</span>. <span style=""color:red;"">it would not have be a relief for PersonX</span> happens after <span style=""color:red;"">the eventuality V1</span>. What is the eventuality V? ?",amber do not do anything happens because PersonX do not exist. it would not have be a relief for PersonX happens after PersonX do not exist. PersonX do exist and PersonX do not exist both happen. PersonX do not exist happens because PersonX do exist.,"<span style=""color:red;"">amber do not do anything</span> happens because <span style=""color:red;"">PersonX do not exist</span>. <span style=""color:red;"">it would not have be a relief for PersonX</span> happens after <span style=""color:red;"">PersonX do not exist</span>. <span style=""color:red;"">PersonX do exist</span> and <span style=""color:red;"">PersonX do not exist</span> both happen. <span style=""color:red;"">PersonX do not exist</span> happens because <span style=""color:red;"">PersonX do exist</span>.",no,no
156,"(p,(Synchronous),(i,(p,(Synchronous),(e,(PersonY be still yell at PersonX))),(p,(Synchronous),(e,(PersonY try to tell PersonX about PersonZ)))))",PersonX put PersonY on hold,"['PersonY try to tell PersonX about PersonZ', 'PersonX hang up on PersonY', 'PersonY be still yell at PersonX', 'PersonX put PersonY on hold']",20220401-194107_q156.png,20220401-194107_a156.png,Synchronous,ip,PersonY be still yell at PersonX happens the same time as the eventuality V1. the eventuality V1 happens the same time as the eventuality V?. PersonY try to tell PersonX about PersonZ happens the same time as the eventuality V1. What is the eventuality V? ?,"<span style=""color:red;"">PersonY be still yell at PersonX</span> happens the same time as <span style=""color:red;"">the eventuality V1</span>. <span style=""color:red;"">the eventuality V1</span> happens the same time as <span style=""color:red;"">the eventuality V?</span>. <span style=""color:red;"">PersonY try to tell PersonX about PersonZ</span> happens the same time as <span style=""color:red;"">the eventuality V1</span>. What is the eventuality V? ?",PersonX hang up on PersonY happens the same time as PersonX put PersonY on hold. PersonY try to tell PersonX about PersonZ happens the same time as PersonX hang up on PersonY. PersonY be still yell at PersonX happens the same time as PersonX hang up on PersonY.,"<span style=""color:red;"">PersonX hang up on PersonY</span> happens the same time as <span style=""color:red;"">PersonX put PersonY on hold</span>. <span style=""color:red;"">PersonY try to tell PersonX about PersonZ</span> happens the same time as <span style=""color:red;"">PersonX hang up on PersonY</span>. <span style=""color:red;"">PersonY be still yell at PersonX</span> happens the same time as <span style=""color:red;"">PersonX hang up on PersonY</span>.",no,no
157,"(p,(Synchronous),(i,(p,(Synchronous),(e,(PersonY be still yell at PersonX))),(p,(Synchronous),(e,(PersonY try to tell PersonX about PersonZ)))))",PersonY ask about PersonZ,"['PersonY try to tell PersonX about PersonZ', 'PersonX hang up on PersonY', 'PersonY be still yell at PersonX', 'PersonY ask about PersonZ']",20220401-194107_q157.png,20220401-194107_a157.png,Synchronous,ip,PersonY be still yell at PersonX happens the same time as the eventuality V1. the eventuality V1 happens the same time as the eventuality V?. PersonY try to tell PersonX about PersonZ happens the same time as the eventuality V1. What is the eventuality V? ?,"<span style=""color:red;"">PersonY be still yell at PersonX</span> happens the same time as <span style=""color:red;"">the eventuality V1</span>. <span style=""color:red;"">the eventuality V1</span> happens the same time as <span style=""color:red;"">the eventuality V?</span>. <span style=""color:red;"">PersonY try to tell PersonX about PersonZ</span> happens the same time as <span style=""color:red;"">the eventuality V1</span>. What is the eventuality V? ?",PersonX hang up on PersonY happens the same time as PersonY ask about PersonZ. PersonY try to tell PersonX about PersonZ happens the same time as PersonX hang up on PersonY. PersonY be still yell at PersonX happens the same time as PersonX hang up on PersonY.,"<span style=""color:red;"">PersonX hang up on PersonY</span> happens the same time as <span style=""color:red;"">PersonY ask about PersonZ</span>. <span style=""color:red;"">PersonY try to tell PersonX about PersonZ</span> happens the same time as <span style=""color:red;"">PersonX hang up on PersonY</span>. <span style=""color:red;"">PersonY be still yell at PersonX</span> happens the same time as <span style=""color:red;"">PersonX hang up on PersonY</span>.",no,no
158,"(p,(Synchronous),(i,(p,(Synchronous),(e,(PersonY be still yell at PersonX))),(p,(Synchronous),(e,(PersonY try to tell PersonX about PersonZ)))))",PersonY refuse to budge,"['PersonY try to tell PersonX about PersonZ', 'PersonX hang up on PersonY', 'PersonY be still yell at PersonX', 'PersonY refuse to budge']",20220401-194107_q158.png,20220401-194107_a158.png,Synchronous,ip,PersonY be still yell at PersonX happens the same time as the eventuality V1. the eventuality V1 happens the same time as the eventuality V?. PersonY try to tell PersonX about PersonZ happens the same time as the eventuality V1. What is the eventuality V? ?,"<span style=""color:red;"">PersonY be still yell at PersonX</span> happens the same time as <span style=""color:red;"">the eventuality V1</span>. <span style=""color:red;"">the eventuality V1</span> happens the same time as <span style=""color:red;"">the eventuality V?</span>. <span style=""color:red;"">PersonY try to tell PersonX about PersonZ</span> happens the same time as <span style=""color:red;"">the eventuality V1</span>. What is the eventuality V? ?",PersonX hang up on PersonY happens the same time as PersonY refuse to budge. PersonY try to tell PersonX about PersonZ happens the same time as PersonX hang up on PersonY. PersonY be still yell at PersonX happens the same time as PersonX hang up on PersonY.,"<span style=""color:red;"">PersonX hang up on PersonY</span> happens the same time as <span style=""color:red;"">PersonY refuse to budge</span>. <span style=""color:red;"">PersonY try to tell PersonX about PersonZ</span> happens the same time as <span style=""color:red;"">PersonX hang up on PersonY</span>. <span style=""color:red;"">PersonY be still yell at PersonX</span> happens the same time as <span style=""color:red;"">PersonX hang up on PersonY</span>.",no,no
159,"(p,(Result),(i,(p,(Condition),(e,(PersonX pick lila up))),(p,(ChosenAlternative),(e,(PersonY be try to tell PersonX)))))",PersonX will sum it up,"['PersonX might be do', 'PersonX pick lila up', 'PersonY be try to tell PersonX', 'PersonX will sum it up']",20220401-194107_q159.png,20220401-194107_a159.png,ChosenAlternative,ip,"When the eventuality V1 happens, PersonX pick lila up can happen. the eventuality V1 result in the eventuality V?. PersonY be try to tell PersonX is a preferred alternative situation to the eventuality V1. What is the eventuality V? ?","When <span style=""color:red;"">the eventuality V1</span> happens, <span style=""color:red;"">PersonX pick lila up</span> can happen. <span style=""color:red;"">the eventuality V1</span> result in <span style=""color:red;"">the eventuality V?</span>. <span style=""color:red;"">PersonY be try to tell PersonX</span> is a preferred alternative situation to <span style=""color:red;"">the eventuality V1</span>. What is the eventuality V? ?","PersonY be try to tell PersonX is a preferred alternative situation to PersonX might be do. When PersonX might be do happens, PersonX pick lila up can happen. PersonX might be do result in PersonX will sum it up.","<span style=""color:red;"">PersonY be try to tell PersonX</span> is a preferred alternative situation to <span style=""color:red;"">PersonX might be do</span>. When <span style=""color:red;"">PersonX might be do</span> happens, <span style=""color:red;"">PersonX pick lila up</span> can happen. <span style=""color:red;"">PersonX might be do</span> result in <span style=""color:red;"">PersonX will sum it up</span>.",no,no
160,"(p,(Reason),(i,(p,(Condition),(e,(PersonY hate maurice))),(p,(Reason),(e,(PersonX pretend to be a protective sister)))))",PersonY take a fancy to PersonZ,"['PersonX pretend to be a protective sister', 'PersonY hate maurice', 'PersonX be jealous of PersonY', 'PersonY take a fancy to PersonZ']",20220401-194107_q160.png,20220401-194107_a160.png,Condition,ip,"When the eventuality V1 happens, PersonY hate maurice can happen. the eventuality V1 happens because the eventuality V?. PersonX pretend to be a protective sister happens because the eventuality V1. What is the eventuality V? ?","When <span style=""color:red;"">the eventuality V1</span> happens, <span style=""color:red;"">PersonY hate maurice</span> can happen. <span style=""color:red;"">the eventuality V1</span> happens because <span style=""color:red;"">the eventuality V?</span>. <span style=""color:red;"">PersonX pretend to be a protective sister</span> happens because <span style=""color:red;"">the eventuality V1</span>. What is the eventuality V? ?","When PersonX be jealous of PersonY happens, PersonY hate maurice can happen. PersonX pretend to be a protective sister happens because PersonX be jealous of PersonY. PersonX be jealous of PersonY happens because PersonY take a fancy to PersonZ.","When <span style=""color:red;"">PersonX be jealous of PersonY</span> happens, <span style=""color:red;"">PersonY hate maurice</span> can happen. <span style=""color:red;"">PersonX pretend to be a protective sister</span> happens because <span style=""color:red;"">PersonX be jealous of PersonY</span>. <span style=""color:red;"">PersonX be jealous of PersonY</span> happens because <span style=""color:red;"">PersonY take a fancy to PersonZ</span>.",yes,yes
161,"(p,(Reason),(i,(p,(Condition),(e,(PersonY hate maurice))),(p,(Reason),(e,(PersonX pretend to be a protective sister)))))",PersonX have a crush on PersonZ,"['PersonX pretend to be a protective sister', 'PersonY hate maurice', 'PersonX be jealous of PersonY', 'PersonX have a crush on PersonZ']",20220401-194107_q161.png,20220401-194107_a161.png,Condition,ip,"When the eventuality V1 happens, PersonY hate maurice can happen. the eventuality V1 happens because the eventuality V?. PersonX pretend to be a protective sister happens because the eventuality V1. What is the eventuality V? ?","When <span style=""color:red;"">the eventuality V1</span> happens, <span style=""color:red;"">PersonY hate maurice</span> can happen. <span style=""color:red;"">the eventuality V1</span> happens because <span style=""color:red;"">the eventuality V?</span>. <span style=""color:red;"">PersonX pretend to be a protective sister</span> happens because <span style=""color:red;"">the eventuality V1</span>. What is the eventuality V? ?","When PersonX be jealous of PersonY happens, PersonY hate maurice can happen. PersonX pretend to be a protective sister happens because PersonX be jealous of PersonY. PersonX be jealous of PersonY happens because PersonX have a crush on PersonZ.","When <span style=""color:red;"">PersonX be jealous of PersonY</span> happens, <span style=""color:red;"">PersonY hate maurice</span> can happen. <span style=""color:red;"">PersonX pretend to be a protective sister</span> happens because <span style=""color:red;"">PersonX be jealous of PersonY</span>. <span style=""color:red;"">PersonX be jealous of PersonY</span> happens because <span style=""color:red;"">PersonX have a crush on PersonZ</span>.",yes,yes
